-- phpMyAdmin SQL Dump
-- version 4.9.7
-- https://www.phpmyadmin.net/
--
-- Host: localhost:3306
-- Generation Time: Aug 29, 2021 at 11:40 AM
-- Server version: 10.3.30-MariaDB-cll-lve
-- PHP Version: 7.3.28

SET SQL_MODE = "NO_AUTO_VALUE_ON_ZERO";
SET AUTOCOMMIT = 0;
START TRANSACTION;


/*!40101 SET @OLD_CHARACTER_SET_CLIENT=@@CHARACTER_SET_CLIENT */;
/*!40101 SET @OLD_CHARACTER_SET_RESULTS=@@CHARACTER_SET_RESULTS */;
/*!40101 SET @OLD_COLLATION_CONNECTION=@@COLLATION_CONNECTION */;
/*!40101 SET NAMES utf8mb4 */;

--
-- Database: `cashfrom_profiledb_dev`
--
CREATE DATABASE IF NOT EXISTS `cashfrom_profiledb_dev` DEFAULT CHARACTER SET latin1 COLLATE latin1_swedish_ci;
USE `cashfrom_profiledb_dev`;

-- --------------------------------------------------------

--
-- Table structure for table `customers_auth`
--

DROP TABLE IF EXISTS `customers_auth`;
CREATE TABLE `customers_auth` (
  `uid` int(11) NOT NULL,
  `name` varchar(50) NOT NULL,
  `email` varchar(50) NOT NULL,
  `phone` varchar(100) NOT NULL,
  `password` varchar(200) NOT NULL,
  `address` varchar(50) NOT NULL,
  `city` varchar(50) NOT NULL,
  `created` timestamp NOT NULL DEFAULT current_timestamp()
) ENGINE=InnoDB DEFAULT CHARSET=latin1;

--
-- Truncate table before insert `customers_auth`
--

TRUNCATE TABLE `customers_auth`;
--
-- Dumping data for table `customers_auth`
--

INSERT INTO `customers_auth` (`uid`, `name`, `email`, `phone`, `password`, `address`, `city`, `created`) VALUES
(190, 'Test', 'test@email.com', '9899999999', 'test', 'mumbai', 'mumbai', '2017-08-06 11:18:55');

-- --------------------------------------------------------

--
-- Table structure for table `ec_posts`
--

DROP TABLE IF EXISTS `ec_posts`;
CREATE TABLE `ec_posts` (
  `post_id` int(11) NOT NULL,
  `user_id` int(11) NOT NULL,
  `post_type` varchar(100) NOT NULL,
  `cr_date_time` datetime NOT NULL DEFAULT current_timestamp()
) ENGINE=InnoDB DEFAULT CHARSET=latin1;

--
-- Truncate table before insert `ec_posts`
--

TRUNCATE TABLE `ec_posts`;
--
-- Dumping data for table `ec_posts`
--

INSERT INTO `ec_posts` (`post_id`, `user_id`, `post_type`, `cr_date_time`) VALUES
(55, 190, 'experience', '2017-08-06 12:11:56'),
(56, 190, 'education', '2017-08-06 12:45:42'),
(57, 190, 'certification', '2017-08-06 12:46:14'),
(58, 190, 'skill', '2017-08-12 21:34:13'),
(59, 190, 'skill', '2017-08-12 21:55:34'),
(60, 190, 'skill', '2017-08-13 20:18:06'),
(61, 190, 'skill', '2017-08-13 20:18:17'),
(62, 190, 'skill', '2017-08-13 20:18:25'),
(63, 190, 'skill', '2017-08-17 21:27:35');

-- --------------------------------------------------------

--
-- Table structure for table `ec_post_meta`
--

DROP TABLE IF EXISTS `ec_post_meta`;
CREATE TABLE `ec_post_meta` (
  `meta_id` int(11) NOT NULL,
  `post_id` int(11) NOT NULL,
  `meta_key` varchar(255) NOT NULL,
  `meta_value` text NOT NULL
) ENGINE=InnoDB DEFAULT CHARSET=latin1;

--
-- Truncate table before insert `ec_post_meta`
--

TRUNCATE TABLE `ec_post_meta`;
--
-- Dumping data for table `ec_post_meta`
--

INSERT INTO `ec_post_meta` (`meta_id`, `post_id`, `meta_key`, `meta_value`) VALUES
(302, 55, 'company_name', 'Encasherr Tech Services'),
(303, 55, 'title', 'Web Developer'),
(304, 55, 'location', 'Mumbai'),
(305, 55, 'from_month', 'Jun'),
(306, 55, 'from_year', '2010'),
(307, 55, 'to_month', 'Apr'),
(308, 55, 'to_year', '2015'),
(309, 55, 'description', 'Working as a web developer. Participate in UX design and development, API design and development. Unit Testing, Requirement analysis, impact analysis. Working as a web developer. Participate in UX design and development, API design and development. Unit Testing, Requirement analysis, impact analysis. Working as a web developer. Participate in UX design and development, API design and development. Unit Testing, Requirement analysis, impact analysis. Working as a web developer. Participate in UX design and development, API design and development. Unit Testing, Requirement analysis, impact analysis.'),
(310, 56, 'school', 'TVM'),
(311, 56, 'degree', 'SSC'),
(312, 56, 'study_field', 'Science'),
(313, 56, 'grade', 'A'),
(314, 56, 'from_year', '1991'),
(315, 56, 'to_year', '1999'),
(316, 57, 'certification_name', 'MCTS'),
(317, 57, 'certification_authority', 'Microsoft'),
(318, 57, 'license_number', '900174'),
(319, 57, 'url', 'www.microsoft.com'),
(320, 58, 'skill_name', 'PHP'),
(321, 59, 'skill_name', 'WPF'),
(322, 60, 'skill_name', 'C#'),
(323, 61, 'skill_name', 'Dotnet Core'),
(324, 62, 'skill_name', 'Web API'),
(325, 63, 'skill_name', 'Java');

-- --------------------------------------------------------

--
-- Table structure for table `location`
--

DROP TABLE IF EXISTS `location`;
CREATE TABLE `location` (
  `id` int(11) NOT NULL,
  `name` varchar(200) NOT NULL,
  `active` varchar(5) NOT NULL DEFAULT '1'
) ENGINE=InnoDB DEFAULT CHARSET=latin1;

--
-- Truncate table before insert `location`
--

TRUNCATE TABLE `location`;
-- --------------------------------------------------------

--
-- Table structure for table `skill`
--

DROP TABLE IF EXISTS `skill`;
CREATE TABLE `skill` (
  `id` int(11) NOT NULL,
  `name` varchar(200) NOT NULL,
  `active` varchar(5) NOT NULL DEFAULT '1'
) ENGINE=InnoDB DEFAULT CHARSET=latin1;

--
-- Truncate table before insert `skill`
--

TRUNCATE TABLE `skill`;
-- --------------------------------------------------------

--
-- Table structure for table `ta_candidates`
--

DROP TABLE IF EXISTS `ta_candidates`;
CREATE TABLE `ta_candidates` (
  `id` int(11) NOT NULL,
  `candidate_meta` longtext CHARACTER SET utf8mb4 COLLATE utf8mb4_bin NOT NULL,
  `user_id` int(11) DEFAULT NULL,
  `time_stamp` datetime NOT NULL DEFAULT current_timestamp()
) ENGINE=MyISAM DEFAULT CHARSET=latin1;

--
-- Truncate table before insert `ta_candidates`
--

TRUNCATE TABLE `ta_candidates`;
--
-- Dumping data for table `ta_candidates`
--

INSERT INTO `ta_candidates` (`id`, `candidate_meta`, `user_id`, `time_stamp`) VALUES
(18, '{\"name\":\"Samir Jha\",\"email\":\"Samirjha9@gmail.com\"}', NULL, '2020-12-04 10:14:08'),
(17, '{\"name\":\"Samir Jha\",\"email\":\"Samirjha9@googlemail.com\"}', NULL, '2020-12-03 18:35:55'),
(16, '{\"name\":\"Samir Jha\",\"email\":\"Samirjha9@gmail.com\"}', NULL, '2020-12-03 17:32:06'),
(15, '{\"name\":\"Samir Jha\",\"email\":\"Samirjha9@gmail.com\"}', NULL, '2020-12-03 17:27:33'),
(14, '{\"name\":\"John Gray\",\"email\":\"john_g@email.com\"}', NULL, '2020-05-16 17:48:58'),
(13, '{\"name\":\"Stephen Finn\",\"email\":\"alok_j110@yahoo.co.in\"}', NULL, '2020-05-16 16:02:19'),
(12, '{\"name\":\"Jon Pitt\",\"email\":\"alok_j110@yahoo.co.in\"}', NULL, '2020-05-16 11:32:05'),
(8, '{\"name\":\"slkfnsjk@efgk.com\",\"email\":\"slkfnsjk@efgk.com\"}', NULL, '2020-05-10 09:31:11'),
(9, '{\"name\":\"slkfnsjk@efgk.com\",\"email\":\"slkfnsjk@efgk.com\"}', NULL, '2020-05-12 18:50:06'),
(10, '{\"name\":\"alkbmdf@slkgf.com\",\"email\":\"alkbmdf@slkgf.com\"}', NULL, '2020-05-13 20:10:50'),
(19, '{\"name\":\"Samir Jha\",\"email\":\"Samirjha9@gmail.com\"}', NULL, '2020-12-04 10:16:34'),
(20, '{\"name\":\"Samir Jha\",\"email\":\"Samirjha9@gmail.com\"}', NULL, '2020-12-04 17:21:35'),
(21, '{\"name\":\"John Gray\",\"email\":\"alok_j110@yahoo.co.in\"}', NULL, '2020-12-04 19:48:59'),
(22, '{\"name\":\"Samir Jha\",\"email\":\"Samirjha9@gmail.com\"}', NULL, '2020-12-04 19:50:38'),
(23, '{\"name\":\"John Gray\",\"email\":\"alok_j110@yahoo.co.in\"}', NULL, '2020-12-04 21:16:22'),
(24, '{\"name\":\"John Gray\",\"email\":\"alok_j110@yahoo.co.in\"}', NULL, '2020-12-04 21:26:56'),
(25, '{\"name\":\"Samir Jha\",\"email\":\"Samirjha9@gmail.com\"}', NULL, '2020-12-04 21:28:46'),
(26, '{\"name\":\"Sameer \",\"email\":\"samirjha9@gmail.com\"}', NULL, '2020-12-05 12:23:11'),
(27, '{\"name\":\" VAKKALAGADDA ANIL\",\"email\":\"anilmani766@gmail.com\"}', NULL, '2020-12-05 12:26:58'),
(28, '{\"name\":\" SHUBHAM R. SHIRKE\",\"email\":\"shubhsshirke@gmail.com\"}', NULL, '2020-12-05 12:27:34'),
(29, '{\"name\":\"  Amit Dattatray Mane\",\"email\":\"maneamit875@gmail.com\"}', NULL, '2020-12-05 12:28:00'),
(30, '{\"name\":\"VAKKALAGADDA ANIL\",\"email\":\"anilmani766@gmail.com\"}', NULL, '2020-12-05 13:45:21'),
(31, '{\"name\":\"John Gray\",\"email\":\"alok_j110@yahoo.co.in\"}', NULL, '2020-12-05 15:45:05'),
(32, '{\"name\":\"John Gray\",\"email\":\"alok_j110@yahoo.co.in\"}', NULL, '2020-12-05 17:41:30'),
(33, '{\"name\":\"John Gray 1\",\"email\":\"alok_j110@yahoo.co.in\"}', NULL, '2020-12-05 17:52:18'),
(144, '{\"name\":\"Anjali Sharma\",\"email\":\"anjalisharma040898@gmail.com\"}', NULL, '2021-06-24 15:58:53'),
(145, '{\"name\":\"Anjali Sharma\",\"email\":\"teamhr@cloudsolutionshub.com\"}', NULL, '2021-06-24 16:00:21'),
(140, '{\"name\":\"Stu One\",\"email\":\"alok_j10@yahoo.co.in\"}', 35, '2021-03-11 14:02:10'),
(141, '{\"name\":\"DHAMMASAGAR NARAYAN SONAWANE\",\"email\":\"dhammsagar@gmail.com\"}', NULL, '2021-04-05 12:06:56'),
(142, '{\"name\":\"Maulik Nai\",\"email\":\"mbnai6005@gmail.com\"}', NULL, '2021-05-29 13:24:31'),
(143, '{\"name\":\"Maulik Nai\",\"email\":\"mbnai6005@gmail.com\"}', NULL, '2021-05-29 15:37:38'),
(41, '{\"name\":\"DHAMMASAGAR NARAYAN SONAWANE\",\"email\":\"dhammsagar@gmail.com\"}', NULL, '2020-12-07 11:22:57'),
(42, '{\"name\":\"VAIBHAV VILAS HADKAR\",\"email\":\"vaibhav18393@gmail.com\"}', NULL, '2020-12-07 11:24:01'),
(43, '{\"name\":\"DHAMMASAGAR NARAYAN SONAWANE\",\"email\":\"dhammsagar@gmail.com\"}', NULL, '2020-12-07 11:57:57'),
(44, '{\"name\":\"Vivek Kumar\",\"email\":\"Vivkumar4@gmail.com\"}', NULL, '2020-12-09 12:21:37'),
(45, '{\"name\":\"PANKAJ SHARMA\",\"email\":\"shpankaj45@gmail.com\"}', NULL, '2020-12-09 12:22:35'),
(46, '{\"name\":\"Anup Patil\",\"email\":\"anupatil73@gmail.com\"}', NULL, '2020-12-09 12:36:39'),
(47, '{\"name\":\"Kapil Kumar Panda\",\"email\":\"kapil.panda97@gmail.com\"}', NULL, '2020-12-09 13:20:51'),
(48, '{\"name\":\"Durgesh Mhatre\",\"email\":\"durgeshmhatre22@gmail.com\"}', NULL, '2020-12-09 14:30:50'),
(49, '{\"name\":\"Vijay Mudaliar\",\"email\":\"vijaymudaliar88@gmail.com\"}', NULL, '2020-12-09 14:35:51'),
(50, '{\"name\":\"Dinesh Mahale\",\"email\":\"dineshmahale42@gmail.com                \"}', NULL, '2020-12-09 15:42:21'),
(51, '{\"name\":\"PRATIK EKNATH SAWANT\",\"email\":\"sawantpratik35@yahoo.com\"}', NULL, '2020-12-09 15:48:33'),
(52, '{\"name\":\"Vivek Kumar\",\"email\":\"Vivkumar4@gmail.com\"}', NULL, '2020-12-09 17:19:24'),
(53, '{\"name\":\"Dinesh Mahale\",\"email\":\"dineshmahale42@gmail.com                \"}', NULL, '2020-12-09 17:42:13'),
(54, '{\"name\":\"Vivek Kumar\",\"email\":\"itsmekumarvivek@gmail.com\"}', NULL, '2020-12-09 17:45:59'),
(55, '{\"name\":\"Vivek Kumar\",\"email\":\"vivkumar4@gmail.com\"}', NULL, '2020-12-09 17:46:26'),
(56, '{\"name\":\"PRADEEP GUNASEKARAN\",\"email\":\"gpradeep12@gmail.com\"}', NULL, '2020-12-09 18:08:00'),
(57, '{\"name\":\"Anjali Sharma\",\"email\":\"anjalisharma040898@gmail.com\"}', NULL, '2020-12-09 19:01:10'),
(58, '{\"name\":\"Pradeep S.Chhapre\",\"email\":\"chhaprepradeep@yahoo.in\"}', NULL, '2020-12-10 14:49:13'),
(59, '{\"name\":\"Sneha Thorat\",\"email\":\"sneha86shine@yahoo.co.in\"}', NULL, '2020-12-11 11:50:30'),
(60, '{\"name\":\"Pradeep S.Chhapre\",\"email\":\"chhaprepradeep@yahoo.in\"}', NULL, '2020-12-11 11:55:08'),
(61, '{\"name\":\"Namrata wadkar\",\"email\":\"namratagwadkar@gmail.com\"}', NULL, '2020-12-11 12:24:17'),
(62, '{\"name\":\"Sandeep Angne\",\"email\":\"sandeepangne@gmail.com\"}', NULL, '2020-12-11 13:07:07'),
(63, '{\"name\":\"Rashmi Deshpande\",\"email\":\"rashmi.ad90@gmail.com\"}', NULL, '2020-12-14 18:02:51'),
(64, '{\"name\":\"Jagan Ready\",\"email\":\"iamjagan168@gmail.com\"}', NULL, '2020-12-14 18:10:54'),
(65, '{\"name\":\"Istyaque Shaikh\",\"email\":\"istyaqueshaikh90@gmail.com\"}', NULL, '2020-12-15 15:03:06'),
(66, '{\"name\":\"Priyanka Dongre\",\"email\":\"priyanka.dongre296@gmail.com\"}', NULL, '2020-12-15 15:20:31'),
(67, '{\"name\":\"Rajanikant Dash\",\"email\":\"dashrajnikant0601@gmail.com\"}', NULL, '2020-12-15 15:21:10'),
(68, '{\"name\":\"Pradeep S.Chhapre\",\"email\":\"chhaprepradeep@yahoo.in\"}', NULL, '2020-12-15 18:07:09'),
(69, '{\"name\":\"Priyaranjan Mahapatra\",\"email\":\"prmahapatra1989@gmail.com\"}', NULL, '2020-12-16 13:02:09'),
(70, '{\"name\":\"Rohit Singh\",\"email\":\"rohitsingh14894@gmail.com\"}', NULL, '2020-12-16 13:02:37'),
(71, '{\"name\":\"Priyanka Kumkale\",\"email\":\"priyakolhe31@gmail.com\"}', NULL, '2020-12-16 13:03:01'),
(72, '{\"name\":\"Deepak Kumar\",\"email\":\"deepakjyan@gmail.com\"}', NULL, '2020-12-16 16:53:09'),
(73, '{\"name\":\"Snehal Chougule\",\"email\":\"snehalchougule18@gmail.com\"}', NULL, '2020-12-18 17:42:22'),
(74, '{\"name\":\"Snehal Chougule\",\"email\":\"snehalchougule18@gmail.com\"}', NULL, '2020-12-18 17:42:22'),
(75, '{\"name\":\"Rajendra Mohite\",\"email\":\"mohiterajendra64@gmail.com\"}', NULL, '2020-12-18 17:43:48'),
(76, '{\"name\":\"Anjali Sharma\",\"email\":\"teamhr@cloudsolutionshub.com\"}', NULL, '2020-12-19 14:56:23'),
(77, '{\"name\":\"Nishant Singh\",\"email\":\"nishantsingh1912@gmail.com\"}', NULL, '2020-12-23 10:36:49'),
(78, '{\"name\":\"Kiran Gurav\",\"email\":\"kirangurav8@gmail.com\"}', NULL, '2020-12-23 13:25:33'),
(79, '{\"name\":\"Amol Murbade\",\"email\":\"amol.murbade1992@gmail.com\"}', NULL, '2021-01-04 12:39:54'),
(80, '{\"name\":\"Mohan Dhole\",\"email\":\"mohandhole53@gmail.com\"}', NULL, '2021-01-11 12:34:18'),
(81, '{\"name\":\"Vipul Redkar\",\"email\":\"vipulredkar@gmail.com\"}', NULL, '2021-01-11 12:34:42'),
(82, '{\"name\":\"Jagnath Gawade\",\"email\":\"gawadejaganathpal@gmail.com\"}', NULL, '2021-01-11 15:47:21'),
(83, '{\"name\":\"Jagnath Gawade\",\"email\":\"gawadejaganathpal@gmail.com\"}', NULL, '2021-01-13 15:34:18'),
(84, '{\"name\":\"Jagnath Gawade\",\"email\":\"jagannathgawade24@gmail.com\"}', NULL, '2021-01-13 15:41:51'),
(85, '{\"name\":\"Jagnath Gawade\",\"email\":\"gawadejaganathpal@gmail.com\"}', NULL, '2021-01-13 15:42:53'),
(86, '{\"name\":\"Prakash Mahto\",\"email\":\"prakashrm89@gmail.com\"}', NULL, '2021-01-13 17:36:20'),
(87, '{\"name\":\"Prakash Mahto\",\"email\":\"prakashrm89@gmail.com\"}', NULL, '2021-01-13 17:56:56'),
(88, '{\"name\":\"Prakash Mahto\",\"email\":\"prakashkrm89@gmail.com\"}', NULL, '2021-01-13 18:01:58'),
(89, '{\"name\":\"Gopal Rajput\",\"email\":\"gopalrajput99@gmail.com\"}', NULL, '2021-01-13 19:08:01'),
(90, '{\"name\":\"Rapaka vishvnathan\",\"email\":\"vissurapaka123@gmail.com\"}', NULL, '2021-01-13 19:18:36'),
(91, '{\"name\":\"Rapaka vishvnathan\",\"email\":\"vissurapaka123@gmail.com\"}', NULL, '2021-01-13 19:19:03'),
(92, '{\"name\":\"Siddhi Murukate\",\"email\":\"siddhimurukate@gmail.com\"}', NULL, '2021-01-14 17:03:07'),
(93, '{\"name\":\"Mayuresh Patankar\",\"email\":\"mayureshpatankar7@gmail.com\"}', NULL, '2021-01-15 12:13:28'),
(146, '{\"name\":\"Tejas Dhondu Redkar\",\"email\":\"tejas031092@gmail.com\"}', NULL, '2021-06-24 16:03:43'),
(96, '{\"name\":\"Shen\",\"email\":\"Bill\"}', NULL, '2021-01-17 13:19:36'),
(147, '{\"name\":\"Tejas Dhondu Redkar\",\"email\":\"tejas031092@gmail.com\"}', NULL, '2021-06-24 16:08:51'),
(98, '{\"name\":\"Atul Malik\",\"email\":\"atulmulik444@gmail.com\"}', NULL, '2021-01-18 17:27:51'),
(99, '{\"name\":\"Pushpak Ulekar\",\"email\":\"ulekarpushpak@gmail.com\"}', NULL, '2021-01-18 17:37:03'),
(100, '{\"name\":\"Shivraj Gore\",\"email\":\"shivrajgore7709@gmail.com\"}', NULL, '2021-01-18 17:46:53'),
(101, '{\"name\":\"Saurabh Pawar\",\"email\":\"saurabh.pawar1790@gmail.com\"}', NULL, '2021-01-18 18:09:38'),
(102, '{\"name\":\"9920934264\",\"email\":\"shreenathiyer95@gmail.com\"}', NULL, '2021-01-19 17:09:27'),
(103, '{\"name\":\"Sripati Kumar Sahu\",\"email\":\"2412sripati@gmail.com\"}', NULL, '2021-01-25 11:36:58'),
(104, '{\"name\":\"Rahul Parab\",\"email\":\"rahulpaelrab242@gmail.com\"}', NULL, '2021-01-25 11:41:24'),
(105, '{\"name\":\"Shriram Garje\",\"email\":\"sgarje0707@gmail.com\"}', NULL, '2021-01-25 17:02:15'),
(106, '{\"name\":\"Harshal Patil\",\"email\":\"harshalhp231@gmail.com\"}', NULL, '2021-01-28 17:45:42'),
(107, '{\"name\":\"Sattyam Singh\",\"email\":\"ssingh8291@gmail.com\"}', NULL, '2021-01-28 18:08:48'),
(108, '{\"name\":\"Rahul parab\",\"email\":\"rahulpaelrab242@gmail.com\"}', NULL, '2021-02-01 14:49:12'),
(109, '{\"name\":\"Shriram Garje\",\"email\":\"sgarje0707@gmail.com\"}', NULL, '2021-02-01 14:50:20'),
(110, '{\"name\":\" Rahul Parab\",\"email\":\"raulparab242@gmail.com\"}', NULL, '2021-02-01 18:02:03'),
(111, '{\"name\":\"Venkat\",\"email\":\"Venkataramanag12@gmail.com\"}', NULL, '2021-02-03 11:30:16'),
(112, '{\"name\":\"Raju \",\"email\":\"knkraju783@gmail.com\"}', NULL, '2021-02-03 12:22:28'),
(113, '{\"name\":\"Smruti kundley\",\"email\":\"smritikundley94@gmail.com\"}', NULL, '2021-02-03 12:27:47'),
(114, '{\"name\":\"Anjali Sharma\",\"email\":\"anjalisharma040898@gmail.com\"}', NULL, '2021-02-03 12:31:51'),
(115, '{\"name\":\"Smruti kundley\",\"email\":\"smritikundley94@gmail.com\"}', NULL, '2021-02-03 12:32:32'),
(116, '{\"name\":\"Smruti kundley\",\"email\":\"smrutikundley94@gmail.com\"}', NULL, '2021-02-03 13:40:11'),
(117, '{\"name\":\"KIRTAN PARMAR\",\"email\":\"kirtan.techie@gmail.com\"}', NULL, '2021-02-09 17:46:10'),
(118, '{\"name\":\"KIRTAN PARMAR\",\"email\":\"kirtanparmar73@yahoo.com\"}', NULL, '2021-02-09 17:47:09'),
(119, '{\"name\":\"Mir Zaffer Aijaz\",\"email\":\"Mirzaffer1994@gmail.com\"}', NULL, '2021-02-09 17:47:48'),
(120, '{\"name\":\"Abhishek Meher\",\"email\":\"theabhishekmeher@gmail.com\"}', NULL, '2021-02-10 15:05:06'),
(121, '{\"name\":\"Siddhesh Dadasaheb Patil\",\"email\":\"siddhesh.patil1899@gmail.com\"}', NULL, '2021-02-13 14:25:44'),
(122, '{\"name\":\"LOVINDU SAI GOPINATH\",\"email\":\"lovindusaigopinath@gmail.com\"}', NULL, '2021-02-13 15:02:35'),
(123, '{\"name\":\"Pankaj Deep Goswami\",\"email\":\"pankajdeepgoswami@gmail.com\"}', NULL, '2021-02-13 15:08:13'),
(124, '{\"name\":\"GANDIKOTA SREENIVASULU\",\"email\":\"sreenivasulugandikota1@gmail.com\"}', NULL, '2021-02-15 10:57:39'),
(125, '{\"name\":\"Tousif Ahmed\",\"email\":\"tousifahmed@protonmail.ch\"}', NULL, '2021-02-15 16:45:22'),
(126, '{\"name\":\"NAMBURI BHARATH\",\"email\":\"namburibharath50959@gmail.com\"}', NULL, '2021-02-15 18:07:32'),
(127, '{\"name\":\"Ankur Hemanth Reddy\",\"email\":\"ankurhemanthreddy@gmail.com\"}', NULL, '2021-02-17 12:21:15'),
(128, '{\"name\":\"Ankur Hemanth Reddy\",\"email\":\"ankurhemanthreddy@gmail.com\"}', NULL, '2021-02-17 12:45:16'),
(129, '{\"name\":\"PRANSHU SHUKLA\",\"email\":\"linktopranshu@gmail.com\"}', NULL, '2021-02-19 10:51:52'),
(148, '{\"name\":\"Anjali Sharma\",\"email\":\"teamhr@cloudsolutionshub.com\"}', NULL, '2021-06-24 18:36:40'),
(149, '{\"name\":\"Anjali Sharma\",\"email\":\"anjalisharma040898@gmail.com\"}', NULL, '2021-06-24 18:37:39'),
(150, '{\"name\":\"Rohit Dilip Agrahari\",\"email\":\"rohitagrahari22@hotmail.com \"}', NULL, '2021-06-30 19:13:32'),
(151, '{\"name\":\"Avinash jha \",\"email\":\"avinashjhaav12@gmail.com\"}', NULL, '2021-06-30 19:14:29'),
(136, '{\"name\":\"Sumedh Mohite.\",\"email\":\"mohitesumedh10@gmail.com\"}', NULL, '2021-03-09 15:37:14'),
(152, '{\"name\":\"Anjali Sharma\",\"email\":\"anjalisharma040898@gmail.com\"}', NULL, '2021-07-01 10:32:35'),
(153, '{\"name\":\"Pramod Vijay Duraphe\",\"email\":\"pramodduraphe@yahoo.in\"}', NULL, '2021-07-01 16:21:11'),
(154, '{\"name\":\"CHANDRASEKHAR NK YADAV\",\"email\":\"konnarc@yahoo.com                                        \"}', NULL, '2021-07-06 16:00:17'),
(155, '{\"name\":\"Mohd Yahya Ansari\",\"email\":\"mohdyahya307@gmail.com            \"}', NULL, '2021-07-06 16:00:55'),
(156, '{\"name\":\"AKSHAY ANIL BAGAL\",\"email\":\"akshaybagal100@gmail.com\"}', NULL, '2021-07-06 18:55:36'),
(157, '{\"name\":\"Kamlesh patil\",\"email\":\"kamlesh.patil18@gmail.com\"}', NULL, '2021-07-13 13:43:59'),
(158, '{\"name\":\"Premkumar Satish Bhavsar\",\"email\":\"prembhavsar7794@gmail.com\"}', NULL, '2021-07-13 13:44:59'),
(159, '{\"name\":\"TEJAS B. MEDHEKAR\",\"email\":\"tejas92@gmail.com\"}', NULL, '2021-07-13 13:55:48'),
(160, '{\"name\":\"Sandip Sunil Pawar\",\"email\":\"co.sandip@gmail.com\"}', NULL, '2021-07-13 14:35:48'),
(161, '{\"name\":\"MOHAMMED ADNAN MULLA\",\"email\":\"mullaadnan46@gmail.com\"}', NULL, '2021-07-20 12:42:47'),
(162, '{\"name\":\"MOHAMMED ADNAN MULLA\",\"email\":\"mullaadnan46@gmail.com\"}', NULL, '2021-07-20 12:43:05'),
(163, '{\"name\":\"1056 New Horizon\",\"email\":\"1056@nhss.com\"}', NULL, '2021-07-25 15:01:04'),
(164, '{\"name\":\"5817 New Horizon\",\"email\":\"5817@nhss.com\"}', NULL, '2021-07-25 15:49:14'),
(165, '{\"name\":\"Alisha \",\"email\":\"sailee.m@cloudsolutionshub.com\"}', NULL, '2021-07-26 17:06:56'),
(166, '{\"name\":\" Aasif Zahir Mulani\",\"email\":\"aasif.mulani@ves.ac.in\"}', NULL, '2021-07-27 11:49:46'),
(167, '{\"name\":\"Abhishek Satve\",\"email\":\"abhisheksatve@gmail.com\"}', NULL, '2021-07-27 12:31:41'),
(168, '{\"name\":\"Akshay Bagal\",\"email\":\"akshaybagal100@gmail.com\"}', NULL, '2021-07-27 12:49:53'),
(169, '{\"name\":\"Kishor Narawade\",\"email\":\"kishor7294@gmail.com\"}', NULL, '2021-07-27 15:17:14'),
(170, '{\"name\":\" Sachin Dhuriya\",\"email\":\"sachingaur4076@gmail.com\"}', NULL, '2021-07-27 15:18:29'),
(171, '{\"name\":\"Atul\",\"email\":\"atuljesus@gmail.com\"}', NULL, '2021-07-27 15:29:57'),
(172, '{\"name\":\"salman siddiqui\",\"email\":\"siddiqui.s385@gmail.com\"}', NULL, '2021-07-27 17:32:44'),
(173, '{\"name\":\"Shashi Kant Kumar\",\"email\":\"shashigiet@gmail.com\"}', NULL, '2021-08-25 18:22:34'),
(174, '{\"name\":\"Ratnesh Kumar\",\"email\":\"ratneshaitglobal@gmail.com\"}', NULL, '2021-08-25 18:23:25'),
(175, '{\"name\":\"Manoj Hatkar\",\"email\":\"manojhatkar09@gmail.com\"}', NULL, '2021-08-26 16:53:32'),
(176, '{\"name\":\"Kaleem Haleem Khan\",\"email\":\"kaleem92khan786@gmail.com\"}', NULL, '2021-08-27 12:26:17'),
(177, '{\"name\":\"AMIT MADHUKAR MORE\",\"email\":\"amit.more67@gmail.com\"}', NULL, '2021-08-27 13:33:53'),
(178, '{\"name\":\"Tushar Devidas Koli\",\"email\":\"tusharkoli272@gmail.com\"}', NULL, '2021-08-28 14:24:17');

-- --------------------------------------------------------

--
-- Table structure for table `ta_categories`
--

DROP TABLE IF EXISTS `ta_categories`;
CREATE TABLE `ta_categories` (
  `id` int(11) NOT NULL,
  `category_meta` longtext CHARACTER SET utf8mb4 COLLATE utf8mb4_bin NOT NULL
) ENGINE=MyISAM DEFAULT CHARSET=latin1;

--
-- Truncate table before insert `ta_categories`
--

TRUNCATE TABLE `ta_categories`;
--
-- Dumping data for table `ta_categories`
--

INSERT INTO `ta_categories` (`id`, `category_meta`) VALUES
(10, '{\"title\":\"Academic\",\"description\":\"Academic\"}'),
(7, '{\"title\":\"Programming\",\"description\":\"Programming Languages\"}'),
(8, '{\"title\":\"Aptitude\",\"description\":\"Aptitude\"}'),
(9, '{\"title\":\"General Knowledge\",\"description\":\"General Knowledge\"}');

-- --------------------------------------------------------

--
-- Table structure for table `ta_config`
--

DROP TABLE IF EXISTS `ta_config`;
CREATE TABLE `ta_config` (
  `id` int(11) NOT NULL,
  `meta_key` varchar(50) NOT NULL,
  `meta_value` text NOT NULL
) ENGINE=MyISAM DEFAULT CHARSET=latin1;

--
-- Truncate table before insert `ta_config`
--

TRUNCATE TABLE `ta_config`;
--
-- Dumping data for table `ta_config`
--

INSERT INTO `ta_config` (`id`, `meta_key`, `meta_value`) VALUES
(1, 'site_url', 'http://techassessment-env.eba-3xxpihaz.ap-south-1.elasticbeanstalk.com'),
(2, 'faq_link', '/candidateFaq/'),
(3, 'admin_api', '/api/admin/'),
(4, 'candidate_api', '/api/candidate/'),
(5, 'site_title', 'Tech Assessment'),
(6, 'min_bulk_count', '1'),
(7, 'max_bulk_count', '30'),
(8, 'user_roles', 'admin,orgadmin,staff,candidate');

-- --------------------------------------------------------

--
-- Table structure for table `ta_grade`
--

DROP TABLE IF EXISTS `ta_grade`;
CREATE TABLE `ta_grade` (
  `id` int(11) NOT NULL,
  `grade_meta` longtext CHARACTER SET utf8mb4 COLLATE utf8mb4_bin NOT NULL,
  `grade_name` varchar(200) NOT NULL,
  `time_stamp` timestamp NOT NULL DEFAULT current_timestamp()
) ENGINE=MyISAM DEFAULT CHARSET=latin1;

--
-- Truncate table before insert `ta_grade`
--

TRUNCATE TABLE `ta_grade`;
--
-- Dumping data for table `ta_grade`
--

INSERT INTO `ta_grade` (`id`, `grade_meta`, `grade_name`, `time_stamp`) VALUES
(2, '{\"name\":\"1\",\"subjects\":[\"EVS\",\"Maths\"]}', '', '2021-03-17 08:06:57'),
(3, '{\"name\":\"2\",\"subjects\":[]}', '', '2021-03-18 09:22:36'),
(4, '{\"name\":\"3\",\"subjects\":[]}', '', '2021-03-18 09:38:36'),
(5, '{\"name\":\"4\",\"subjects\":[]}', '', '2021-03-18 09:43:16');

-- --------------------------------------------------------

--
-- Table structure for table `ta_invitations`
--

DROP TABLE IF EXISTS `ta_invitations`;
CREATE TABLE `ta_invitations` (
  `id` int(11) NOT NULL,
  `invitation_meta` longtext CHARACTER SET utf8mb4 COLLATE utf8mb4_bin NOT NULL,
  `isLive` tinyint(1) NOT NULL DEFAULT 1,
  `time_stamp` datetime NOT NULL DEFAULT current_timestamp()
) ENGINE=MyISAM DEFAULT CHARSET=latin1;

--
-- Truncate table before insert `ta_invitations`
--

TRUNCATE TABLE `ta_invitations`;
--
-- Dumping data for table `ta_invitations`
--

INSERT INTO `ta_invitations` (`id`, `invitation_meta`, `isLive`, `time_stamp`) VALUES
(7, '{\"candidateId\":13,\"testId\":9,\"status\":\"COMPLETED\",\"invitedOn\":\"5/16/2020\",\"createdBy\":2,\"completedOn\":\"5/16/2020\"}', 0, '2020-05-16 16:02:30'),
(2, '{\"candidateId\":8,\"testId\":2,\"status\":\"COMPLETED\",\"invitedOn\":\"5/10/2020\"}', 0, '2020-05-10 09:31:12'),
(3, '{\"candidateId\":9,\"testId\":6,\"status\":\"COMPLETED\",\"invitedOn\":\"5/12/2020\",\"completedOn\":\"5/15/2020\"}', 0, '2020-05-12 18:50:08'),
(4, '{\"candidateId\":10,\"testId\":4,\"status\":\"COMPLETED\",\"invitedOn\":\"5/13/2020\",\"completedOn\":\"5/15/2020\"}', 0, '2020-05-13 20:10:51'),
(6, '{\"candidateId\":12,\"testId\":6,\"status\":\"COMPLETED\",\"invitedOn\":\"5/16/2020\",\"completedOn\":\"5/16/2020\"}', 0, '2020-05-16 11:32:06'),
(8, '{\"candidateId\":14,\"testId\":10,\"status\":\"COMPLETED\",\"invitedOn\":\"5/16/2020\",\"createdBy\":2,\"completedOn\":\"5/16/2020\"}', 0, '2020-05-16 17:48:59'),
(9, '{\"candidateId\":15,\"testId\":13,\"createdBy\":9,\"status\":\"INITIATED\",\"invitedOn\":\"12/3/2020\"}', 0, '2020-12-03 17:27:34'),
(10, '{\"candidateId\":16,\"testId\":13,\"createdBy\":9,\"status\":\"INITIATED\",\"invitedOn\":\"12/3/2020\"}', 0, '2020-12-03 17:32:07'),
(11, '{\"candidateId\":17,\"testId\":13,\"createdBy\":9,\"status\":\"INITIATED\",\"invitedOn\":\"12/3/2020\"}', 0, '2020-12-03 18:35:56'),
(12, '{\"candidateId\":18,\"testId\":13,\"createdBy\":9,\"status\":\"INITIATED\",\"invitedOn\":\"12/4/2020\"}', 0, '2020-12-04 10:14:09'),
(13, '{\"candidateId\":19,\"testId\":13,\"createdBy\":9,\"status\":\"INITIATED\",\"invitedOn\":\"12/4/2020\"}', 0, '2020-12-04 10:16:34'),
(14, '{\"candidateId\":20,\"testId\":13,\"createdBy\":9,\"status\":\"INITIATED\",\"invitedOn\":\"12/4/2020\"}', 0, '2020-12-04 17:21:36'),
(15, '{\"candidateId\":21,\"testId\":9,\"createdBy\":2,\"status\":\"INITIATED\",\"invitedOn\":\"12/4/2020\"}', 0, '2020-12-04 19:48:59'),
(16, '{\"candidateId\":22,\"testId\":13,\"createdBy\":9,\"status\":\"INITIATED\",\"invitedOn\":\"12/4/2020\"}', 0, '2020-12-04 19:50:39'),
(17, '{\"candidateId\":23,\"testId\":9,\"createdBy\":2,\"status\":\"INITIATED\",\"invitedOn\":\"12/4/2020\"}', 0, '2020-12-04 21:16:23'),
(18, '{\"candidateId\":24,\"testId\":9,\"createdBy\":2,\"status\":\"INITIATED\",\"invitedOn\":\"12/4/2020\"}', 0, '2020-12-04 21:26:56'),
(145, '{\"candidateId\":144,\"testId\":15,\"createdBy\":9,\"status\":\"INITIATED\",\"invitedOn\":\"6/24/2021\"}', 1, '2021-06-24 15:58:53'),
(20, '{\"candidateId\":26,\"testId\":13,\"createdBy\":9,\"status\":\"INITIATED\",\"invitedOn\":\"12/5/2020\"}', 0, '2020-12-05 12:23:11'),
(21, '{\"candidateId\":27,\"testId\":13,\"createdBy\":9,\"status\":\"INITIATED\",\"invitedOn\":\"12/5/2020\"}', 1, '2020-12-05 12:26:59'),
(22, '{\"candidateId\":28,\"testId\":13,\"createdBy\":9,\"status\":\"COMPLETED\",\"invitedOn\":\"12/5/2020\",\"completedOn\":\"12/5/2020\"}', 1, '2020-12-05 12:27:35'),
(23, '{\"candidateId\":29,\"testId\":13,\"createdBy\":9,\"status\":\"COMPLETED\",\"invitedOn\":\"12/5/2020\",\"completedOn\":\"12/5/2020\"}', 1, '2020-12-05 12:28:00'),
(24, '{\"candidateId\":30,\"testId\":13,\"createdBy\":9,\"status\":\"INITIATED\",\"invitedOn\":\"12/5/2020\"}', 0, '2020-12-05 13:45:22'),
(25, '{\"candidateId\":31,\"testId\":9,\"createdBy\":2,\"status\":\"INITIATED\",\"invitedOn\":\"12/5/2020\"}', 0, '2020-12-05 15:45:05'),
(26, '{\"candidateId\":32,\"testId\":9,\"createdBy\":2,\"status\":\"INITIATED\",\"invitedOn\":\"12/5/2020\"}', 0, '2020-12-05 17:41:31'),
(27, '{\"candidateId\":33,\"testId\":9,\"createdBy\":2,\"status\":\"INITIATED\",\"invitedOn\":\"12/5/2020\"}', 0, '2020-12-05 17:52:18'),
(141, '{\"candidateId\":140,\"testId\":19,\"createdBy\":37,\"status\":\"COMPLETED\",\"invitedOn\":\"3/11/2021\",\"completedOn\":\"2021-3-11 14:16\"}', 1, '2021-03-11 14:02:11'),
(142, '{\"candidateId\":141,\"testId\":15,\"createdBy\":9,\"status\":\"COMPLETED\",\"invitedOn\":\"4/5/2021\",\"completedOn\":\"2021-4-5 06:55\"}', 1, '2021-04-05 12:06:57'),
(143, '{\"candidateId\":142,\"testId\":13,\"createdBy\":9,\"status\":\"INITIATED\",\"invitedOn\":\"5/29/2021\"}', 1, '2021-05-29 13:24:31'),
(144, '{\"candidateId\":143,\"testId\":13,\"createdBy\":9,\"status\":\"INITIATED\",\"invitedOn\":\"5/29/2021\"}', 1, '2021-05-29 15:37:39'),
(35, '{\"candidateId\":41,\"testId\":13,\"createdBy\":9,\"status\":\"COMPLETED\",\"invitedOn\":\"12/7/2020\",\"completedOn\":\"2020-12-7 7:6\"}', 1, '2020-12-07 11:22:58'),
(36, '{\"candidateId\":42,\"testId\":13,\"createdBy\":9,\"status\":\"COMPLETED\",\"invitedOn\":\"12/7/2020\",\"completedOn\":\"2020-12-7 7:2\"}', 1, '2020-12-07 11:24:02'),
(37, '{\"candidateId\":43,\"testId\":13,\"createdBy\":9,\"status\":\"INITIATED\",\"invitedOn\":\"12/7/2020\"}', 1, '2020-12-07 11:57:58'),
(38, '{\"candidateId\":44,\"testId\":13,\"createdBy\":9,\"status\":\"COMPLETED\",\"invitedOn\":\"12/9/2020\",\"completedOn\":\"2020-12-9 13:26\"}', 1, '2020-12-09 12:21:38'),
(39, '{\"candidateId\":45,\"testId\":13,\"createdBy\":9,\"status\":\"COMPLETED\",\"invitedOn\":\"12/9/2020\",\"completedOn\":\"2020-12-9 7:35\"}', 1, '2020-12-09 12:22:36'),
(40, '{\"candidateId\":46,\"testId\":13,\"createdBy\":9,\"status\":\"COMPLETED\",\"invitedOn\":\"12/9/2020\",\"completedOn\":\"2020-12-9 7:39\"}', 1, '2020-12-09 12:36:39'),
(41, '{\"candidateId\":47,\"testId\":13,\"createdBy\":9,\"status\":\"COMPLETED\",\"invitedOn\":\"12/9/2020\",\"completedOn\":\"2020-12-9 8:0\"}', 1, '2020-12-09 13:20:52'),
(42, '{\"candidateId\":48,\"testId\":13,\"createdBy\":9,\"status\":\"COMPLETED\",\"invitedOn\":\"12/9/2020\",\"completedOn\":\"2020-12-9 9:7\"}', 1, '2020-12-09 14:30:51'),
(43, '{\"candidateId\":49,\"testId\":13,\"createdBy\":9,\"status\":\"COMPLETED\",\"invitedOn\":\"12/9/2020\",\"completedOn\":\"2020-12-9 9:44\"}', 1, '2020-12-09 14:35:51'),
(44, '{\"candidateId\":50,\"testId\":13,\"createdBy\":9,\"status\":\"COMPLETED\",\"invitedOn\":\"12/9/2020\",\"completedOn\":\"2020-12-9 12:1\"}', 1, '2020-12-09 15:42:22'),
(45, '{\"candidateId\":51,\"testId\":13,\"createdBy\":9,\"status\":\"COMPLETED\",\"invitedOn\":\"12/9/2020\",\"completedOn\":\"2020-12-9 11:33\"}', 1, '2020-12-09 15:48:33'),
(46, '{\"candidateId\":52,\"testId\":13,\"createdBy\":9,\"status\":\"COMPLETED\",\"invitedOn\":\"12/9/2020\",\"completedOn\":\"2020-12-9 14:13\"}', 1, '2020-12-09 17:19:25'),
(47, '{\"candidateId\":53,\"testId\":13,\"createdBy\":9,\"status\":\"COMPLETED\",\"invitedOn\":\"12/9/2020\",\"completedOn\":\"2020-12-9 12:50\"}', 1, '2020-12-09 17:42:14'),
(48, '{\"candidateId\":54,\"testId\":13,\"createdBy\":9,\"status\":\"INITIATED\",\"invitedOn\":\"12/9/2020\"}', 1, '2020-12-09 17:46:00'),
(49, '{\"candidateId\":55,\"testId\":13,\"createdBy\":9,\"status\":\"INITIATED\",\"invitedOn\":\"12/9/2020\"}', 1, '2020-12-09 17:46:26'),
(50, '{\"candidateId\":56,\"testId\":13,\"createdBy\":9,\"status\":\"COMPLETED\",\"invitedOn\":\"12/9/2020\",\"completedOn\":\"2020-12-9 18:48\"}', 1, '2020-12-09 18:08:01'),
(51, '{\"candidateId\":57,\"testId\":13,\"createdBy\":9,\"status\":\"COMPLETED\",\"invitedOn\":\"12/9/2020\",\"completedOn\":\"2020-12-9 13:32\"}', 1, '2020-12-09 19:01:11'),
(52, '{\"candidateId\":58,\"testId\":13,\"createdBy\":9,\"status\":\"COMPLETED\",\"invitedOn\":\"12/10/2020\",\"completedOn\":\"2020-12-10 13:15\"}', 1, '2020-12-10 14:49:14'),
(53, '{\"candidateId\":59,\"testId\":13,\"createdBy\":9,\"status\":\"COMPLETED\",\"invitedOn\":\"12/11/2020\",\"completedOn\":\"2020-12-11 7:37\"}', 1, '2020-12-11 11:50:31'),
(54, '{\"candidateId\":60,\"testId\":13,\"createdBy\":9,\"status\":\"COMPLETED\",\"invitedOn\":\"12/11/2020\",\"completedOn\":\"2020-12-15 12:34\"}', 1, '2020-12-11 11:55:09'),
(55, '{\"candidateId\":61,\"testId\":13,\"createdBy\":9,\"status\":\"COMPLETED\",\"invitedOn\":\"12/11/2020\",\"completedOn\":\"2020-12-11 7:50\"}', 1, '2020-12-11 12:24:17'),
(56, '{\"candidateId\":62,\"testId\":13,\"createdBy\":9,\"status\":\"INITIATED\",\"invitedOn\":\"12/11/2020\"}', 1, '2020-12-11 13:07:08'),
(57, '{\"candidateId\":63,\"testId\":13,\"createdBy\":9,\"status\":\"COMPLETED\",\"invitedOn\":\"12/14/2020\",\"completedOn\":\"2020-12-14 15:46\"}', 1, '2020-12-14 18:02:52'),
(58, '{\"candidateId\":64,\"testId\":13,\"createdBy\":9,\"status\":\"COMPLETED\",\"invitedOn\":\"12/14/2020\",\"completedOn\":\"2020-12-14 12:58\"}', 1, '2020-12-14 18:10:54'),
(59, '{\"candidateId\":65,\"testId\":15,\"createdBy\":9,\"status\":\"COMPLETED\",\"invitedOn\":\"12/15/2020\",\"completedOn\":\"2020-12-15 12:21\"}', 1, '2020-12-15 15:03:07'),
(60, '{\"candidateId\":66,\"testId\":15,\"createdBy\":9,\"status\":\"COMPLETED\",\"invitedOn\":\"12/15/2020\",\"completedOn\":\"2020-12-15 10:29\"}', 1, '2020-12-15 15:20:32'),
(61, '{\"candidateId\":67,\"testId\":15,\"createdBy\":9,\"status\":\"INITIATED\",\"invitedOn\":\"12/15/2020\"}', 1, '2020-12-15 15:21:11'),
(62, '{\"candidateId\":68,\"testId\":15,\"createdBy\":9,\"status\":\"COMPLETED\",\"invitedOn\":\"12/15/2020\",\"completedOn\":\"2020-12-15 13:34\"}', 1, '2020-12-15 18:07:09'),
(63, '{\"candidateId\":69,\"testId\":15,\"createdBy\":9,\"status\":\"COMPLETED\",\"invitedOn\":\"12/16/2020\",\"completedOn\":\"2020-12-17 15:42\"}', 1, '2020-12-16 13:02:10'),
(64, '{\"candidateId\":70,\"testId\":15,\"createdBy\":9,\"status\":\"COMPLETED\",\"invitedOn\":\"12/16/2020\",\"completedOn\":\"2020-12-16 8:1\"}', 1, '2020-12-16 13:02:37'),
(65, '{\"candidateId\":71,\"testId\":15,\"createdBy\":9,\"status\":\"COMPLETED\",\"invitedOn\":\"12/16/2020\",\"completedOn\":\"2020-12-16 9:47\"}', 1, '2020-12-16 13:03:02'),
(66, '{\"candidateId\":72,\"testId\":15,\"createdBy\":9,\"status\":\"COMPLETED\",\"invitedOn\":\"12/16/2020\",\"completedOn\":\"2020-12-21 5:54\"}', 1, '2020-12-16 16:53:10'),
(67, '{\"candidateId\":73,\"testId\":15,\"createdBy\":9,\"status\":\"INITIATED\",\"invitedOn\":\"12/18/2020\"}', 1, '2020-12-18 17:42:22'),
(68, '{\"candidateId\":74,\"testId\":15,\"createdBy\":9,\"status\":\"INITIATED\",\"invitedOn\":\"12/18/2020\"}', 1, '2020-12-18 17:42:22'),
(69, '{\"candidateId\":75,\"testId\":15,\"createdBy\":9,\"status\":\"COMPLETED\",\"invitedOn\":\"12/18/2020\",\"completedOn\":\"2020-12-18 13:49\"}', 1, '2020-12-18 17:43:48'),
(70, '{\"candidateId\":76,\"testId\":15,\"createdBy\":9,\"status\":\"INITIATED\",\"invitedOn\":\"12/19/2020\"}', 1, '2020-12-19 14:56:23'),
(71, '{\"candidateId\":77,\"testId\":15,\"createdBy\":9,\"status\":\"COMPLETED\",\"invitedOn\":\"12/23/2020\",\"completedOn\":\"2020-12-23 6:47\"}', 1, '2020-12-23 10:36:49'),
(72, '{\"candidateId\":78,\"testId\":15,\"createdBy\":9,\"status\":\"COMPLETED\",\"invitedOn\":\"12/23/2020\",\"completedOn\":\"2020-12-23 16:9\"}', 1, '2020-12-23 13:25:34'),
(73, '{\"candidateId\":79,\"testId\":15,\"createdBy\":9,\"status\":\"COMPLETED\",\"invitedOn\":\"1/4/2021\",\"completedOn\":\"2021-1-4 08:14\"}', 1, '2021-01-04 12:39:55'),
(74, '{\"candidateId\":80,\"testId\":15,\"createdBy\":9,\"status\":\"COMPLETED\",\"invitedOn\":\"1/11/2021\",\"completedOn\":\"2021-1-11 07:22\"}', 1, '2021-01-11 12:34:19'),
(75, '{\"candidateId\":81,\"testId\":15,\"createdBy\":9,\"status\":\"COMPLETED\",\"invitedOn\":\"1/11/2021\",\"completedOn\":\"2021-1-11 10:39\"}', 1, '2021-01-11 12:34:43'),
(76, '{\"candidateId\":82,\"testId\":13,\"createdBy\":9,\"status\":\"INITIATED\",\"invitedOn\":\"1/11/2021\"}', 1, '2021-01-11 15:47:21'),
(77, '{\"candidateId\":83,\"testId\":13,\"createdBy\":9,\"status\":\"INITIATED\",\"invitedOn\":\"1/13/2021\"}', 1, '2021-01-13 15:34:18'),
(78, '{\"candidateId\":84,\"testId\":13,\"createdBy\":9,\"status\":\"COMPLETED\",\"invitedOn\":\"1/13/2021\",\"completedOn\":\"2021-1-13 10:25\"}', 1, '2021-01-13 15:41:52'),
(79, '{\"candidateId\":85,\"testId\":13,\"createdBy\":9,\"status\":\"INITIATED\",\"invitedOn\":\"1/13/2021\"}', 1, '2021-01-13 15:42:53'),
(80, '{\"candidateId\":86,\"testId\":15,\"createdBy\":9,\"status\":\"INITIATED\",\"invitedOn\":\"1/13/2021\"}', 1, '2021-01-13 17:36:21'),
(81, '{\"candidateId\":87,\"testId\":15,\"createdBy\":9,\"status\":\"INITIATED\",\"invitedOn\":\"1/13/2021\"}', 1, '2021-01-13 17:56:57'),
(82, '{\"candidateId\":88,\"testId\":15,\"createdBy\":9,\"status\":\"COMPLETED\",\"invitedOn\":\"1/13/2021\",\"completedOn\":\"2021-1-13 13:11\"}', 1, '2021-01-13 18:01:58'),
(83, '{\"candidateId\":89,\"testId\":13,\"createdBy\":9,\"status\":\"COMPLETED\",\"invitedOn\":\"1/13/2021\",\"completedOn\":\"2021-1-13 16:27\"}', 1, '2021-01-13 19:08:01'),
(84, '{\"candidateId\":90,\"testId\":13,\"createdBy\":9,\"status\":\"COMPLETED\",\"invitedOn\":\"1/13/2021\",\"completedOn\":\"2021-1-13 14:40\"}', 1, '2021-01-13 19:18:37'),
(85, '{\"candidateId\":91,\"testId\":15,\"createdBy\":9,\"status\":\"COMPLETED\",\"invitedOn\":\"1/13/2021\",\"completedOn\":\"2021-1-13 14:28\"}', 1, '2021-01-13 19:19:03'),
(86, '{\"candidateId\":92,\"testId\":13,\"createdBy\":9,\"status\":\"COMPLETED\",\"invitedOn\":\"1/14/2021\",\"completedOn\":\"2021-1-15 13:33\"}', 1, '2021-01-14 17:03:08'),
(87, '{\"candidateId\":93,\"testId\":13,\"createdBy\":9,\"status\":\"COMPLETED\",\"invitedOn\":\"1/15/2021\",\"completedOn\":\"2021-1-15 07:39\"}', 1, '2021-01-15 12:13:29'),
(146, '{\"candidateId\":145,\"testId\":15,\"createdBy\":9,\"status\":\"INITIATED\",\"invitedOn\":\"6/24/2021\"}', 1, '2021-06-24 16:00:21'),
(147, '{\"candidateId\":146,\"testId\":15,\"createdBy\":9,\"status\":\"INITIATED\",\"invitedOn\":\"6/24/2021\"}', 1, '2021-06-24 16:03:43'),
(148, '{\"candidateId\":147,\"testId\":15,\"createdBy\":9,\"status\":\"INITIATED\",\"invitedOn\":\"6/24/2021\"}', 1, '2021-06-24 16:08:51'),
(149, '{\"candidateId\":148,\"testId\":15,\"createdBy\":9,\"status\":\"INITIATED\",\"invitedOn\":\"6/24/2021\"}', 1, '2021-06-24 18:36:40'),
(92, '{\"candidateId\":98,\"testId\":15,\"createdBy\":9,\"status\":\"COMPLETED\",\"invitedOn\":\"1/18/2021\",\"completedOn\":\"2021-1-18 17:42\"}', 1, '2021-01-18 17:27:51'),
(93, '{\"candidateId\":99,\"testId\":13,\"createdBy\":9,\"status\":\"INITIATED\",\"invitedOn\":\"1/18/2021\"}', 1, '2021-01-18 17:37:04'),
(94, '{\"candidateId\":100,\"testId\":13,\"createdBy\":9,\"status\":\"COMPLETED\",\"invitedOn\":\"1/18/2021\",\"completedOn\":\"2021-1-18 12:42\"}', 1, '2021-01-18 17:46:54'),
(95, '{\"candidateId\":101,\"testId\":15,\"createdBy\":9,\"status\":\"COMPLETED\",\"invitedOn\":\"1/18/2021\",\"completedOn\":\"2021-1-18 13:54\"}', 1, '2021-01-18 18:09:38'),
(96, '{\"candidateId\":102,\"testId\":13,\"createdBy\":9,\"status\":\"COMPLETED\",\"invitedOn\":\"1/19/2021\",\"completedOn\":\"2021-1-19 13:46\"}', 1, '2021-01-19 17:09:28'),
(97, '{\"candidateId\":103,\"testId\":15,\"createdBy\":9,\"status\":\"COMPLETED\",\"invitedOn\":\"1/25/2021\",\"completedOn\":\"2021-1-25 17:46\"}', 1, '2021-01-25 11:36:59'),
(98, '{\"candidateId\":104,\"testId\":15,\"createdBy\":9,\"status\":\"INITIATED\",\"invitedOn\":\"1/25/2021\"}', 1, '2021-01-25 11:41:25'),
(99, '{\"candidateId\":105,\"testId\":15,\"createdBy\":9,\"status\":\"INITIATED\",\"invitedOn\":\"1/25/2021\"}', 1, '2021-01-25 17:02:15'),
(100, '{\"candidateId\":106,\"testId\":15,\"createdBy\":9,\"status\":\"INITIATED\",\"invitedOn\":\"1/28/2021\"}', 1, '2021-01-28 17:45:42'),
(101, '{\"candidateId\":107,\"testId\":15,\"createdBy\":9,\"status\":\"INITIATED\",\"invitedOn\":\"1/28/2021\"}', 1, '2021-01-28 18:08:49'),
(102, '{\"candidateId\":108,\"testId\":15,\"createdBy\":9,\"status\":\"INITIATED\",\"invitedOn\":\"2/1/2021\"}', 1, '2021-02-01 14:49:13'),
(103, '{\"candidateId\":109,\"testId\":15,\"createdBy\":9,\"status\":\"COMPLETED\",\"invitedOn\":\"2/1/2021\",\"completedOn\":\"2021-2-1 11:34\"}', 1, '2021-02-01 14:50:21'),
(104, '{\"candidateId\":110,\"testId\":15,\"createdBy\":9,\"status\":\"COMPLETED\",\"invitedOn\":\"2/1/2021\",\"completedOn\":\"2021-2-1 15:47\"}', 1, '2021-02-01 18:02:03'),
(105, '{\"candidateId\":111,\"testId\":15,\"createdBy\":9,\"status\":\"COMPLETED\",\"invitedOn\":\"2/3/2021\",\"completedOn\":\"2021-2-3 12:12\"}', 1, '2021-02-03 11:30:17'),
(106, '{\"candidateId\":112,\"testId\":15,\"createdBy\":9,\"status\":\"INITIATED\",\"invitedOn\":\"2/3/2021\"}', 1, '2021-02-03 12:22:29'),
(107, '{\"candidateId\":113,\"testId\":15,\"createdBy\":9,\"status\":\"INITIATED\",\"invitedOn\":\"2/3/2021\"}', 1, '2021-02-03 12:27:48'),
(108, '{\"candidateId\":114,\"testId\":15,\"createdBy\":9,\"status\":\"INITIATED\",\"invitedOn\":\"2/3/2021\"}', 1, '2021-02-03 12:31:51'),
(109, '{\"candidateId\":115,\"testId\":15,\"createdBy\":9,\"status\":\"INITIATED\",\"invitedOn\":\"2/3/2021\"}', 1, '2021-02-03 12:32:33'),
(110, '{\"candidateId\":116,\"testId\":15,\"createdBy\":9,\"status\":\"COMPLETED\",\"invitedOn\":\"2/3/2021\",\"completedOn\":\"2021-2-3 09:06\"}', 1, '2021-02-03 13:40:12'),
(111, '{\"candidateId\":117,\"testId\":13,\"createdBy\":9,\"status\":\"COMPLETED\",\"invitedOn\":\"2/9/2021\",\"completedOn\":\"2021-2-11 08:11\"}', 1, '2021-02-09 17:46:10'),
(112, '{\"candidateId\":118,\"testId\":13,\"createdBy\":9,\"status\":\"INITIATED\",\"invitedOn\":\"2/9/2021\"}', 1, '2021-02-09 17:47:10'),
(113, '{\"candidateId\":119,\"testId\":13,\"createdBy\":9,\"status\":\"INITIATED\",\"invitedOn\":\"2/9/2021\"}', 1, '2021-02-09 17:47:49'),
(114, '{\"candidateId\":120,\"testId\":13,\"createdBy\":9,\"status\":\"INITIATED\",\"invitedOn\":\"2/10/2021\"}', 1, '2021-02-10 15:05:06'),
(115, '{\"candidateId\":121,\"testId\":13,\"createdBy\":9,\"status\":\"COMPLETED\",\"invitedOn\":\"2/13/2021\",\"completedOn\":\"2021-2-14 06:32\"}', 1, '2021-02-13 14:25:44'),
(116, '{\"candidateId\":122,\"testId\":13,\"createdBy\":9,\"status\":\"COMPLETED\",\"invitedOn\":\"2/13/2021\",\"completedOn\":\"2021-2-13 13:06\"}', 1, '2021-02-13 15:02:35'),
(117, '{\"candidateId\":123,\"testId\":13,\"createdBy\":9,\"status\":\"COMPLETED\",\"invitedOn\":\"2/13/2021\",\"completedOn\":\"2021-2-13 09:50\"}', 1, '2021-02-13 15:08:13'),
(118, '{\"candidateId\":124,\"testId\":13,\"createdBy\":9,\"status\":\"COMPLETED\",\"invitedOn\":\"2/15/2021\",\"completedOn\":\"2021-2-15 05:37\"}', 1, '2021-02-15 10:57:40'),
(119, '{\"candidateId\":125,\"testId\":13,\"createdBy\":9,\"status\":\"COMPLETED\",\"invitedOn\":\"2/15/2021\",\"completedOn\":\"2021-2-15 16:42\"}', 1, '2021-02-15 16:45:23'),
(120, '{\"candidateId\":126,\"testId\":13,\"createdBy\":9,\"status\":\"COMPLETED\",\"invitedOn\":\"2/15/2021\",\"completedOn\":\"2021-2-15 13:04\"}', 1, '2021-02-15 18:07:32'),
(121, '{\"candidateId\":127,\"testId\":13,\"createdBy\":9,\"status\":\"COMPLETED\",\"invitedOn\":\"2/17/2021\",\"completedOn\":\"2021-2-17 07:06\"}', 1, '2021-02-17 12:21:16'),
(122, '{\"candidateId\":128,\"testId\":13,\"createdBy\":9,\"status\":\"COMPLETED\",\"invitedOn\":\"2/17/2021\",\"completedOn\":\"2021-2-17 07:40\"}', 1, '2021-02-17 12:45:17'),
(123, '{\"candidateId\":129,\"testId\":13,\"createdBy\":9,\"status\":\"COMPLETED\",\"invitedOn\":\"2/19/2021\",\"completedOn\":\"2021-2-19 07:38\"}', 1, '2021-02-19 10:51:52'),
(150, '{\"candidateId\":149,\"testId\":13,\"createdBy\":9,\"status\":\"INITIATED\",\"invitedOn\":\"6/24/2021\"}', 1, '2021-06-24 18:37:39'),
(151, '{\"candidateId\":150,\"testId\":15,\"createdBy\":9,\"status\":\"COMPLETED\",\"invitedOn\":\"6/30/2021\",\"completedOn\":\"2021-6-30 14:38\"}', 1, '2021-06-30 19:13:33'),
(152, '{\"candidateId\":151,\"testId\":15,\"createdBy\":9,\"status\":\"COMPLETED\",\"invitedOn\":\"6/30/2021\",\"completedOn\":\"2021-7-1 06:22\"}', 1, '2021-06-30 19:14:29'),
(153, '{\"candidateId\":152,\"testId\":15,\"createdBy\":9,\"status\":\"COMPLETED\",\"invitedOn\":\"7/1/2021\",\"completedOn\":\"2021-7-1 05:03\"}', 1, '2021-07-01 10:32:36'),
(154, '{\"candidateId\":153,\"testId\":15,\"createdBy\":9,\"status\":\"COMPLETED\",\"invitedOn\":\"7/1/2021\",\"completedOn\":\"2021-7-3 11:14\"}', 1, '2021-07-01 16:21:11'),
(130, '{\"candidateId\":136,\"testId\":13,\"createdBy\":9,\"status\":\"COMPLETED\",\"invitedOn\":\"3/9/2021\",\"completedOn\":\"2021-3-9 18:12\"}', 1, '2021-03-09 15:37:14'),
(155, '{\"candidateId\":154,\"testId\":15,\"createdBy\":9,\"status\":\"COMPLETED\",\"invitedOn\":\"7/6/2021\",\"completedOn\":\"2021-7-6 11:17\"}', 1, '2021-07-06 16:00:17'),
(156, '{\"candidateId\":155,\"testId\":15,\"createdBy\":9,\"status\":\"INITIATED\",\"invitedOn\":\"7/6/2021\"}', 1, '2021-07-06 16:00:55'),
(157, '{\"candidateId\":156,\"testId\":15,\"createdBy\":9,\"status\":\"COMPLETED\",\"invitedOn\":\"7/6/2021\",\"completedOn\":\"2021-7-6 15:49\"}', 1, '2021-07-06 18:55:37'),
(158, '{\"candidateId\":157,\"testId\":15,\"createdBy\":9,\"status\":\"COMPLETED\",\"invitedOn\":\"7/13/2021\",\"completedOn\":\"2021-7-13 11:54\"}', 1, '2021-07-13 13:44:00'),
(159, '{\"candidateId\":158,\"testId\":15,\"createdBy\":9,\"status\":\"INITIATED\",\"invitedOn\":\"7/13/2021\"}', 1, '2021-07-13 13:45:00'),
(160, '{\"candidateId\":159,\"testId\":15,\"createdBy\":9,\"status\":\"INITIATED\",\"invitedOn\":\"7/13/2021\"}', 1, '2021-07-13 13:55:48'),
(161, '{\"candidateId\":160,\"testId\":15,\"createdBy\":9,\"status\":\"INITIATED\",\"invitedOn\":\"7/13/2021\"}', 1, '2021-07-13 14:35:49'),
(162, '{\"candidateId\":161,\"testId\":13,\"createdBy\":9,\"status\":\"INITIATED\",\"invitedOn\":\"7/20/2021\"}', 1, '2021-07-20 12:42:48'),
(163, '{\"candidateId\":162,\"testId\":15,\"createdBy\":9,\"status\":\"INITIATED\",\"invitedOn\":\"7/20/2021\"}', 1, '2021-07-20 12:43:05'),
(164, '{\"candidateId\":163,\"testId\":20,\"createdBy\":2,\"status\":\"COMPLETED\",\"invitedOn\":\"25/7/2021\",\"completedOn\":\"2021-7-25 17:33\"}', 0, '2021-07-25 15:01:04'),
(165, '{\"candidateId\":140,\"testId\":20,\"createdBy\":2,\"status\":\"COMPLETED\",\"invitedOn\":\"25/7/2021\",\"completedOn\":\"2021-7-25 15:19\"}', 0, '2021-07-25 15:05:29'),
(166, '{\"candidateId\":164,\"testId\":21,\"createdBy\":2,\"status\":\"COMPLETED\",\"invitedOn\":\"25/7/2021\",\"completedOn\":\"2021-7-25 17:03\"}', 0, '2021-07-25 15:49:15'),
(167, '{\"candidateId\":165,\"testId\":13,\"createdBy\":9,\"status\":\"COMPLETED\",\"invitedOn\":\"7/26/2021\",\"completedOn\":\"2021-7-26 11:40\"}', 1, '2021-07-26 17:06:56'),
(168, '{\"candidateId\":166,\"testId\":15,\"createdBy\":9,\"status\":\"COMPLETED\",\"invitedOn\":\"7/27/2021\",\"completedOn\":\"2021-7-27 09:00\"}', 1, '2021-07-27 11:49:47'),
(169, '{\"candidateId\":167,\"testId\":15,\"createdBy\":9,\"status\":\"INITIATED\",\"invitedOn\":\"7/27/2021\"}', 1, '2021-07-27 12:31:41'),
(170, '{\"candidateId\":168,\"testId\":15,\"createdBy\":9,\"status\":\"COMPLETED\",\"invitedOn\":\"7/27/2021\",\"completedOn\":\"2021-7-27 09:07\"}', 1, '2021-07-27 12:49:54'),
(171, '{\"candidateId\":169,\"testId\":15,\"createdBy\":9,\"status\":\"INITIATED\",\"invitedOn\":\"7/27/2021\"}', 1, '2021-07-27 15:17:15'),
(172, '{\"candidateId\":170,\"testId\":15,\"createdBy\":9,\"status\":\"INITIATED\",\"invitedOn\":\"7/27/2021\"}', 1, '2021-07-27 15:18:30'),
(173, '{\"candidateId\":171,\"testId\":15,\"createdBy\":9,\"status\":\"INITIATED\",\"invitedOn\":\"7/27/2021\"}', 1, '2021-07-27 15:29:58'),
(174, '{\"candidateId\":172,\"testId\":15,\"createdBy\":9,\"status\":\"COMPLETED\",\"invitedOn\":\"7/27/2021\",\"completedOn\":\"2021-7-27 12:49\"}', 1, '2021-07-27 17:32:44'),
(175, '{\"candidateId\":140,\"testId\":15,\"createdBy\":2,\"status\":\"COMPLETED\",\"invitedOn\":\"27/7/2021\",\"completedOn\":\"2021-8-1 10:29\",\"resultEmailStatus\":\"Email Sent on 2021-08-02 23:12\"}', 0, '2021-07-27 20:45:52'),
(176, '{\"candidateId\":140,\"testId\":15,\"createdBy\":9,\"status\":\"INITIATED\",\"invitedOn\":\"8/24/2021\",\"invitationEmailStatus\":\"Invite sent on 2021-08-24 12:41\"}', 1, '2021-08-24 18:11:13'),
(177, '{\"candidateId\":145,\"testId\":15,\"createdBy\":9,\"status\":\"INITIATED\",\"invitedOn\":\"8/25/2021\",\"invitationEmailStatus\":\"Invite sent on 2021-08-25 06:11\"}', 1, '2021-08-25 11:41:44'),
(178, '{\"candidateId\":145,\"testId\":15,\"createdBy\":9,\"status\":\"INITIATED\",\"invitedOn\":\"8/25/2021\",\"invitationEmailStatus\":\"Invite sent on 2021-08-25 06:11\"}', 1, '2021-08-25 11:41:45'),
(179, '{\"candidateId\":145,\"testId\":15,\"createdBy\":9,\"status\":\"INITIATED\",\"invitedOn\":\"8/25/2021\",\"invitationEmailStatus\":\"Invite sent on 2021-08-25 06:11\"}', 1, '2021-08-25 11:41:45'),
(180, '{\"candidateId\":145,\"testId\":15,\"createdBy\":9,\"status\":\"INITIATED\",\"invitedOn\":\"8/25/2021\",\"invitationEmailStatus\":\"Invite sent on 2021-08-25 06:11\"}', 1, '2021-08-25 11:41:46'),
(181, '{\"candidateId\":173,\"testId\":15,\"createdBy\":9,\"status\":\"COMPLETED\",\"invitedOn\":\"8/25/2021\",\"invitationEmailStatus\":\"Invite sent on 2021-08-25 12:52\",\"completedOn\":\"2021-8-25 16:49\"}', 1, '2021-08-25 18:22:35'),
(182, '{\"candidateId\":174,\"testId\":15,\"createdBy\":9,\"status\":\"INITIATED\",\"invitedOn\":\"8/25/2021\",\"invitationEmailStatus\":\"Invite sent on 2021-08-25 12:53\"}', 1, '2021-08-25 18:23:26'),
(183, '{\"candidateId\":174,\"testId\":15,\"createdBy\":9,\"status\":\"COMPLETED\",\"invitedOn\":\"8/26/2021\",\"invitationEmailStatus\":\"Invite sent on 2021-08-26 06:08\",\"completedOn\":\"2021-8-26 07:03\"}', 1, '2021-08-26 11:38:40'),
(184, '{\"candidateId\":175,\"testId\":15,\"createdBy\":9,\"status\":\"COMPLETED\",\"invitedOn\":\"8/26/2021\",\"invitationEmailStatus\":\"Invite sent on 2021-08-26 11:23\",\"completedOn\":\"2021-8-26 12:14\"}', 1, '2021-08-26 16:53:33'),
(185, '{\"candidateId\":176,\"testId\":13,\"createdBy\":9,\"status\":\"COMPLETED\",\"invitedOn\":\"8/27/2021\",\"invitationEmailStatus\":\"Invite sent on 2021-08-27 06:56\",\"completedOn\":\"2021-8-27 07:43\"}', 1, '2021-08-27 12:26:17'),
(186, '{\"candidateId\":176,\"testId\":13,\"createdBy\":9,\"status\":\"INITIATED\",\"invitedOn\":\"8/27/2021\",\"invitationEmailStatus\":\"Invite sent on 2021-08-27 07:47\"}', 1, '2021-08-27 13:17:37'),
(187, '{\"candidateId\":177,\"testId\":15,\"createdBy\":9,\"status\":\"COMPLETED\",\"invitedOn\":\"8/27/2021\",\"invitationEmailStatus\":\"Invite sent on 2021-08-27 08:03\",\"completedOn\":\"2021-8-27 08:19\"}', 1, '2021-08-27 13:33:54'),
(188, '{\"candidateId\":176,\"testId\":15,\"createdBy\":9,\"status\":\"COMPLETED\",\"invitedOn\":\"8/27/2021\",\"invitationEmailStatus\":\"Invite sent on 2021-08-27 08:04\",\"completedOn\":\"2021-8-27 09:02\"}', 1, '2021-08-27 13:34:18'),
(189, '{\"candidateId\":178,\"testId\":15,\"createdBy\":9,\"status\":\"COMPLETED\",\"invitedOn\":\"8/28/2021\",\"invitationEmailStatus\":\"Invite sent on 2021-08-28 08:54\",\"completedOn\":\"2021-8-28 10:49\"}', 1, '2021-08-28 14:24:18');

-- --------------------------------------------------------

--
-- Table structure for table `ta_mcq`
--

DROP TABLE IF EXISTS `ta_mcq`;
CREATE TABLE `ta_mcq` (
  `id` int(11) NOT NULL,
  `mcq_meta` longtext CHARACTER SET utf8mb4 COLLATE utf8mb4_bin NOT NULL,
  `skill` varchar(200) DEFAULT NULL,
  `category` varchar(200) DEFAULT NULL,
  `grade` varchar(100) DEFAULT NULL,
  `subject` varchar(100) DEFAULT NULL,
  `time_stamp` datetime NOT NULL DEFAULT current_timestamp(),
  `addedBy` varchar(100) DEFAULT NULL
) ENGINE=MyISAM DEFAULT CHARSET=latin1;

--
-- Truncate table before insert `ta_mcq`
--

TRUNCATE TABLE `ta_mcq`;
--
-- Dumping data for table `ta_mcq`
--

INSERT INTO `ta_mcq` (`id`, `mcq_meta`, `skill`, `category`, `grade`, `subject`, `time_stamp`, `addedBy`) VALUES
(61, '{\"choices\":[{\"content\":\"A table that is currently being modified by a DML statement like defining triggers in a table is known as a Mutating table.\nA table that might need to be read from for a referential integrity constraint is known as constraining table\",\"isCorrect\":true,\"key\":\"A\"},{\"content\":\"A table that is not currently being modified by a DML statement like defining triggers in a table is known as a Mutating table.\nA table that might not need to be read from for a referential integrity constraint is known as constraining table\",\"isCorrect\":false,\"key\":\"B\"}],\"category\":\"Programming\",\"skill\":\"PLSQL\",\"question\":\"Mutating & Constraining Tables\",\"description\":\"What is the mutating table and constraining table?\",\"minimumExperience\":\"1\",\"maximumExperience\":\"10\",\"score\":\"10\",\"correctAnswer\":\"A\",\"addedBy\":\"encasherr@gmail.com\"}', 'PLSQL', 'Programming', NULL, NULL, '2020-10-05 08:37:38', '2'),
(60, '{\"choices\":[{\"content\":\"Closing a cursor jams the private SQL area as well as allocates memory\",\"isCorrect\":false,\"key\":\"A\"},{\"content\":\"Closing a cursor clears the private SQL area as well as de-allocates memory\",\"isCorrect\":true,\"key\":\"B\"}],\"category\":\"Programming\",\"skill\":\"PLSQL\",\"question\":\"Close Cursor\",\"description\":\"What does closing a cursor do?\",\"minimumExperience\":\"1\",\"maximumExperience\":\"10\",\"score\":\"10\",\"correctAnswer\":\"B\",\"addedBy\":\"encasherr@gmail.com\"}', 'PLSQL', 'Programming', NULL, NULL, '2020-10-05 08:37:38', '2'),
(104, '{\"question\":\"Tourist Attractions\",\"description\":\"<p>Kullu is in which state?</p>\r\n\",\"category\":\"General Knowledge\",\"skill\":\"PLSQL\",\"minimumExperience\":0,\"maximumExperience\":10,\"choices\":[{\"content\":\"<p>Uttarakhand</p>\r\n\",\"isCorrect\":false,\"key\":\"A\"},{\"content\":\"<p>Rajasthan</p>\r\n\",\"isCorrect\":false,\"key\":\"B\"},{\"content\":\"<p>Himachal Pradesh</p>\r\n\",\"isCorrect\":true,\"key\":\"C\"},{\"content\":\"<p>Uttar Pradesh</p>\r\n\",\"isCorrect\":false,\"key\":\"D\"}],\"score\":\"5\",\"createdBy\":2,\"createdOn\":\"2/25/2021\"}', NULL, 'General Knowledge', NULL, NULL, '2021-02-25 21:25:05', '37'),
(105, '{\"question\":\"Indian States & Cities\",\"description\":\"<p>Mount Abu is in which state?</p>\n\",\"category\":\"General Knowledge\",\"skill\":\"Academic\",\"minimumExperience\":0,\"maximumExperience\":10,\"choices\":[{\"content\":\"<p>Gujarat</p>\n\",\"isCorrect\":false,\"key\":\"A\"},{\"content\":\"<p>West Bengal</p>\n\",\"isCorrect\":false,\"key\":\"B\"},{\"content\":\"<p>Tamil Nadu</p>\n\",\"isCorrect\":false,\"key\":\"C\"},{\"content\":\"<p>Rajasthan</p>\n\",\"isCorrect\":true,\"key\":\"D\"}],\"score\":\"5\",\"createdBy\":2,\"createdOn\":\"2/25/2021\"}', NULL, 'General Knowledge', NULL, NULL, '2021-02-25 21:27:41', '37'),
(56, '{\"choices\":[{\"content\":\"Intersect is the product of two tables and it lists only matching rows.\",\"isCorrect\":true,\"key\":\"A\"},{\"content\":\"Intersect is not a product of two tables and it lists all rows.\",\"isCorrect\":false,\"key\":\"B\"}],\"category\":\"Programming\",\"skill\":\"PLSQL\",\"question\":\"Intersect\",\"description\":\"What is an Intersect?\",\"minimumExperience\":\"1\",\"maximumExperience\":\"10\",\"score\":\"10\",\"correctAnswer\":\"A\",\"addedBy\":\"encasherr@gmail.com\"}', 'PLSQL', 'Programming', NULL, NULL, '2020-10-05 08:37:38', '2'),
(57, '{\"choices\":[{\"content\":\"Cursor is a named private area in SQL from which information can be accessed. They are required to process each row individually for queries which return multiple rows.\",\"isCorrect\":true,\"key\":\"A\"},{\"content\":\"Cursor is a named public area in SQL from which information can be accessed. They are required to process each row individually for queries which return multiple rows.\",\"isCorrect\":false,\"key\":\"B\"}],\"category\":\"Programming\",\"skill\":\"PLSQL\",\"question\":\"Cursor\",\"description\":\"Explain uses of cursor.\",\"minimumExperience\":\"1\",\"maximumExperience\":\"10\",\"score\":\"10\",\"correctAnswer\":\"A\",\"addedBy\":\"encasherr@gmail.com\"}', 'PLSQL', 'Programming', NULL, NULL, '2020-10-05 08:37:38', '2'),
(58, '{\"choices\":[{\"content\":\"Procedure allow the DML statements without any restrictions\nFunction does not allow the DML statements \",\"isCorrect\":true,\"key\":\"A\"},{\"content\":\"Procedure does not allow the DML statements without any restrictions\nFunction  allow the DML statements \",\"isCorrect\":false,\"key\":\"B\"}],\"category\":\"Programming\",\"skill\":\"PLSQL\",\"question\":\"Procedure  & Function\",\"description\":\"What is Difference between procedure and function?\",\"minimumExperience\":\"1\",\"maximumExperience\":\"10\",\"score\":\"10\",\"correctAnswer\":\"A\",\"addedBy\":\"encasherr@gmail.com\"}', 'PLSQL', 'Programming', NULL, NULL, '2020-10-05 08:37:38', '2'),
(55, '{\"choices\":[{\"content\":\"A syntax error can be easily detected by a PL/SQL compiler. For eg, incorrect spelling.\nA runtime error is handled with the help of exception-handling section in an PL/SQL block. For eg, SELECT INTO statement, which does not return any rows.\",\"isCorrect\":true,\"key\":\"A\"},{\"content\":\"A syntax error cannot be easily detected by a PL/SQL compiler. For eg, incorrect spelling.\nA runtime error is not handled with the help of exception-handling section in an PL/SQL block. For eg, SELECT INTO statement, which does not return any rows.\",\"isCorrect\":false,\"key\":\"B\"}],\"category\":\"Programming\",\"skill\":\"PLSQL\",\"question\":\"Differentiate Errors\",\"description\":\"Differentiate between Syntax and runtime errors.\",\"minimumExperience\":\"1\",\"maximumExperience\":\"10\",\"score\":\"10\",\"correctAnswer\":\"A\",\"addedBy\":\"encasherr@gmail.com\"}', 'PLSQL', 'Programming', NULL, NULL, '2020-10-05 08:37:38', '2'),
(106, '{\"question\":\"Indian States & Cities\",\"description\":\"<p>Mussourie is in which state?</p>\n\",\"category\":\"General Knowledge\",\"skill\":\"Academic\",\"minimumExperience\":0,\"maximumExperience\":10,\"choices\":[{\"content\":\"<p>Uttarakhand</p>\n\",\"isCorrect\":true,\"key\":\"A\"},{\"content\":\"<p>Jammu &amp; Kashmir</p>\n\",\"isCorrect\":false,\"key\":\"B\"},{\"content\":\"<p>Maharashtra</p>\n\",\"isCorrect\":false,\"key\":\"C\"},{\"content\":\"<p>Tamil Nadu</p>\n\",\"isCorrect\":false,\"key\":\"D\"}],\"score\":\"5\",\"createdBy\":2,\"createdOn\":\"2/25/2021\"}', NULL, 'General Knowledge', NULL, NULL, '2021-02-25 21:29:23', '37'),
(107, '{\"question\":\"Indian States & Cities\",\"description\":\"<p>Below cities belong to which state?</p>\n<p>Kanyakumari, Ooty &amp; Kodaikanal</p>\n\",\"category\":\"General Knowledge\",\"skill\":\"Academic\",\"minimumExperience\":0,\"maximumExperience\":10,\"choices\":[{\"content\":\"<p>Karnataka</p>\n\",\"isCorrect\":false,\"key\":\"A\"},{\"content\":\"<p>Andhra Pradesh</p>\n\",\"isCorrect\":false,\"key\":\"B\"},{\"content\":\"<p>Kerala</p>\n\",\"isCorrect\":false,\"key\":\"C\"},{\"content\":\"<p>Tamil Nadu</p>\n\",\"isCorrect\":true,\"key\":\"D\"}],\"score\":\"5\",\"createdBy\":2,\"createdOn\":\"2/25/2021\"}', NULL, 'General Knowledge', NULL, NULL, '2021-02-25 21:30:48', '37'),
(53, '{\"choices\":[{\"content\":\"% ROWTYPE is used when a query returns an entire row of a table or view.\nTYPE RECORD, on the other hand, is used when a query returns column of different tables or views.\",\"isCorrect\":true,\"key\":\"A\"},{\"content\":\"% ROWTYPE is used when a query does not return an entire row of a table or view.\nTYPE RECORD, on the other hand, is used when a query does not return column of different tables or views.\",\"isCorrect\":false,\"key\":\"B\"}],\"category\":\"Programming\",\"skill\":\"PLSQL\",\"question\":\"ROWTYPE and TYPE RECORD\",\"description\":\"Differentiate between % ROWTYPE and TYPE RECORD.\",\"minimumExperience\":\"1\",\"maximumExperience\":\"10\",\"score\":\"10\",\"correctAnswer\":\"A\",\"addedBy\":\"encasherr@gmail.com\"}', 'PLSQL', 'Programming', NULL, NULL, '2020-10-05 08:37:38', '2'),
(103, '{\"question\":\"NULL Comparisons\",\"description\":\"<p>What are the rules to be applied to NULLs whilst doing comparisons?</p>\n\",\"category\":\"Programming\",\"skill\":\"PLSQL\",\"minimumExperience\":1,\"maximumExperience\":10,\"choices\":[{\"content\":\"<ul>\n	<li>NULL is always TRUE or FALSE</li>\n	<li>NULL can be equal or unequal to other values</li>\n	<li>If a value in an expression is NULL, then the expression itself does not evaluates to NULL except for concatenation operator (||)</li>\n</ul>\n\",\"isCorrect\":false,\"key\":\"A\"},{\"content\":\"<ul>\n	<li>NULL is never TRUE or FALSE&nbsp;</li>\n	<li>NULL cannot be equal or unequal to other values</li>\n	<li>If a value in an expression is NULL, then the expression itself evaluates to NULL except for concatenation operator (||)</li>\n</ul>\n\",\"isCorrect\":true,\"key\":\"B\"}],\"score\":\"10\",\"createdBy\":2,\"createdOn\":\"2/24/2021\"}', 'PLSQL', 'Programming', NULL, NULL, '2021-02-24 12:09:50', '2'),
(108, '{\"question\":\"Indian States & Cities\",\"description\":\"<p>The famous tourist place Darjeeling belongs to which state?</p>\n\",\"category\":\"General Knowledge\",\"skill\":\"Academic\",\"minimumExperience\":0,\"maximumExperience\":10,\"choices\":[{\"content\":\"<p>Orissa</p>\n\",\"isCorrect\":false,\"key\":\"A\"},{\"content\":\"<p>Assam</p>\n\",\"isCorrect\":false,\"key\":\"B\"},{\"content\":\"<p>West Bengal</p>\n\",\"isCorrect\":true,\"key\":\"C\"},{\"content\":\"<p>Uttarakhand</p>\n\",\"isCorrect\":false,\"key\":\"D\"}],\"score\":\"5\",\"createdBy\":2,\"createdOn\":\"2/25/2021\"}', NULL, 'General Knowledge', NULL, NULL, '2021-02-25 21:32:12', '37'),
(63, '{\"choices\":[{\"content\":\"A cursor is not implicit by default. The user cannot control or process the information in this cursor.\nIf a query returns multiple rows of data, the program does not defines an explicit cursor. This does not allows the application to process each row sequentially as the cursor returns it.\",\"isCorrect\":false,\"key\":\"A\"},{\"content\":\"A cursor is implicit by default. The user cannot control or process the information in this cursor.\nIf a query returns multiple rows of data, the program defines an explicit cursor. This allows the application to process each row sequentially as the cursor returns it.\",\"isCorrect\":true,\"key\":\"B\"}],\"category\":\"Programming\",\"skill\":\"PLSQL\",\"question\":\"Implicit & Explicit Cursors\",\"description\":\"Define Implicit and Explicit Cursors.\",\"minimumExperience\":\"1\",\"maximumExperience\":\"10\",\"score\":\"10\",\"correctAnswer\":\"B\",\"addedBy\":\"encasherr@gmail.com\"}', 'PLSQL', 'Programming', NULL, NULL, '2020-10-05 08:37:38', '2'),
(64, '{\"choices\":[{\"content\":\"ROWID is not the logical address of a row, it is  a physical column. It composes of data  number, file  and row number in the data block. Thus, I/O time gets maximized retrieving the row, and results in a faster query.\",\"isCorrect\":false,\"key\":\"A\"},{\"content\":\"ROWID is the logical address of a row, it is not a physical column. It composes of data block number, file number and row number in the data block. Thus, I/O time gets minimized retrieving the row, and results in a faster query.\",\"isCorrect\":true,\"key\":\"B\"}],\"category\":\"Programming\",\"skill\":\"PLSQL\",\"question\":\"ROWID\",\"description\":\"How does ROWID help in running a query faster?\",\"minimumExperience\":\"1\",\"maximumExperience\":\"10\",\"score\":\"10\",\"correctAnswer\":\"B\",\"addedBy\":\"encasherr@gmail.com\"}', 'PLSQL', 'Programming', NULL, NULL, '2020-10-05 08:37:38', '2'),
(65, '{\"choices\":[{\"content\":\"Sequences are used to generate sequence numbers without an overhead of locking. Its drawback is that the sequence number is lost if the transaction is rolled back.\",\"isCorrect\":true,\"key\":\"A\"},{\"content\":\"Sequences are not used to generate sequence numbers without an overhead of locking. Its advantage is that the sequence number is lost if the transaction is rolled back.\",\"isCorrect\":false,\"key\":\"B\"}],\"category\":\"Programming\",\"skill\":\"PLSQL\",\"question\":\"Sequences\",\"description\":\"What are sequences?\",\"minimumExperience\":\"1\",\"maximumExperience\":\"10\",\"score\":\"10\",\"correctAnswer\":\"A\",\"addedBy\":\"encasherr@gmail.com\"}', 'PLSQL', 'Programming', NULL, NULL, '2020-10-05 08:37:38', '2'),
(66, '{\"choices\":[{\"content\":\"Fetching a cursor writes Result Set row by row.\",\"isCorrect\":false,\"key\":\"A\"},{\"content\":\"Fetching a cursor reads Result Set row by row.\",\"isCorrect\":true,\"key\":\"B\"}],\"category\":\"Programming\",\"skill\":\"PLSQL\",\"question\":\"Fetch Cursor\",\"description\":\"What does fetching a cursor do?\",\"minimumExperience\":\"1\",\"maximumExperience\":\"10\",\"score\":\"10\",\"correctAnswer\":\"B\",\"addedBy\":\"encasherr@gmail.com\"}', 'PLSQL', 'Programming', NULL, NULL, '2020-10-05 08:37:38', '2'),
(67, '{\"choices\":[{\"content\":\"Truncate is a DDL command\nDelete is a DML command\",\"isCorrect\":true,\"key\":\"A\"},{\"content\":\"Truncate is a DML command\nDelete is a DDL command\",\"isCorrect\":false,\"key\":\"B\"}],\"category\":\"Programming\",\"skill\":\"PLSQL\",\"question\":\"Truncate & Delete\",\"description\":\"What is difference between TRUNCATE & DELETE?\",\"minimumExperience\":\"1\",\"maximumExperience\":\"10\",\"score\":\"10\",\"correctAnswer\":\"A\",\"addedBy\":\"encasherr@gmail.com\"}', 'PLSQL', 'Programming', NULL, NULL, '2020-10-05 08:37:38', '2'),
(68, '{\"question\":\"JOINS\",\"description\":\"What is a join?\",\"category\":\"Programming\",\"skill\":\"PLSQL\",\"minimumExperience\":1,\"maximumExperience\":10,\"choices\":[{\"content\":\"Join is a query, which retrieves related columns or rows from multiple tables.\",\"isCorrect\":true,\"key\":\"A\"},{\"content\":\"Join is a query, which deposits related columns or rows from multiple tables.\",\"isCorrect\":false,\"key\":\"B\"}],\"score\":\"10\",\"createdBy\":2,\"createdOn\":\"10/5/2020\"}', 'PLSQL', 'Programming', NULL, NULL, '2020-10-05 20:45:31', '2'),
(69, '{\"question\":\"JVM Architecture\",\"description\":\"Which of the following are components of Java Virtual Machine?\",\"category\":\"Programming\",\"skill\":\"JAVA\",\"minimumExperience\":2,\"maximumExperience\":10,\"choices\":[{\"content\":\"Heap Stack\",\"isCorrect\":true,\"key\":\"A\"},{\"content\":\"Execution Engine\",\"isCorrect\":false,\"key\":\"B\"},{\"content\":\"Registers\",\"isCorrect\":false,\"key\":\"C\"},{\"content\":\"Class Type Specification\",\"isCorrect\":false,\"key\":\"D\"},{\"content\":\"Finalizer\",\"isCorrect\":false,\"key\":\"E\"}],\"score\":\"10\",\"createdBy\":2,\"createdOn\":\"12/5/2020\"}', 'PLSQL', 'Programming', NULL, NULL, '2020-12-05 18:51:34', '2'),
(70, '{\"question\":\"Classloader\",\"description\":\"Which of the following are types of class loaders?\",\"category\":\"Programming\",\"skill\":\"JAVA\",\"minimumExperience\":1,\"maximumExperience\":10,\"choices\":[{\"content\":\"Bootstrap class loader\",\"isCorrect\":true,\"key\":\"A\"},{\"content\":\"Global Assembly loader\",\"isCorrect\":false,\"key\":\"B\"},{\"content\":\"Type Loader\",\"isCorrect\":false,\"key\":\"C\"},{\"content\":\"Extension class loader\",\"isCorrect\":true,\"key\":\"D\"}],\"score\":\"10\",\"createdBy\":2,\"createdOn\":\"12/5/2020\"}', 'PLSQL', 'Programming', NULL, NULL, '2020-12-05 18:54:55', '2'),
(71, '{\"choices\":[{\"content\":\"The implicit cursor is automatically declared by oracle every time an sql statement is executed\nAn explicit cursor is created and managed by the user.\",\"isCorrect\":true,\"key\":\"A\"},{\"content\":\"The implicit cursor is automatically declared by oracle every time an sql statement is executed\nAn explicit cursor is created and managed by the user.\",\"isCorrect\":false,\"key\":\"B\"}],\"category\":\"Programming\",\"skill\":\"PLSQL\",\"question\":\"Cursor\",\"description\":\"What is explicit and implicit cursor?\",\"minimumExperience\":\"1\",\"maximumExperience\":\"10\",\"score\":\"10\",\"correctAnswer\":\"A\",\"addedBy\":\"encasherr@gmail.com\"}', 'PLSQL', 'Programming', NULL, NULL, '2020-12-13 21:10:59', '2'),
(72, '{\"choices\":[{\"content\":\"Cursor is private sql area which is used to execute sql statements and store processing information\",\"isCorrect\":true,\"key\":\"A\"},{\"content\":\"Cursor is public sql area which is used to execute sql statements and store processing information\",\"isCorrect\":false,\"key\":\"B\"}],\"category\":\"Programming\",\"skill\":\"PLSQL\",\"question\":\"Cursor\",\"description\":\"What is Cursor?\",\"minimumExperience\":\"1\",\"maximumExperience\":\"10\",\"score\":\"10\",\"correctAnswer\":\"A\",\"addedBy\":\"encasherr@gmail.com\"}', 'PLSQL', 'Programming', NULL, NULL, '2020-12-13 21:10:59', '2'),
(73, '{\"choices\":[{\"content\":\"Join is a query, which retrieves related columns or rows from multiple tables.\",\"isCorrect\":true,\"key\":\"A\"},{\"content\":\"Join is a query, which deposits related columns or rows from multiple tables.\",\"isCorrect\":false,\"key\":\"B\"}],\"category\":\"Programming\",\"skill\":\"PLSQL\",\"question\":\"JOINS\",\"description\":\"What is a join?\",\"minimumExperience\":\"1\",\"maximumExperience\":\"10\",\"score\":\"10\",\"correctAnswer\":\"A\",\"addedBy\":\"encasherr@gmail.com\"}', 'PLSQL', 'Programming', NULL, NULL, '2020-12-13 21:10:59', '2'),
(102, '{\"question\":\"Commit, Rollback & Savepoint\",\"description\":\"<p>Which of the following are correct statements about Commit, Rollback and Savepoint?</p>\n\",\"category\":\"Programming\",\"skill\":\"PLSQL\",\"minimumExperience\":1,\"maximumExperience\":10,\"choices\":[{\"content\":\"<p>For a COMMIT statement, the following is true:</p>\n\n<ul>\n	<li>Other users can see the data changes made by the transaction. &nbsp;</li>\n	<li>The locks acquired by the transaction are released.</li>\n	<li>The work done by the transaction becomes permanent.</li>\n</ul>\n\n<p>A ROLLBACK statement gets issued when the transaction ends, and the following is true.</p>\n\n<ul>\n	<li>The work done in a transition is undone as if it was never issued.</li>\n	<li>All locks acquired by transaction are released.</li>\n	<li>It undoes all the work done by the user in a transaction.</li>\n</ul>\n\n<p>With SAVEPOINT, only part of transaction can be undone.</p>\n\",\"isCorrect\":true,\"key\":\"A\"},{\"content\":\"<p>For a COMMIT statement, the following is not true:</p>\n\n<ul>\n	<li>Other users can see the data changes made by the transaction.</li>\n	<li>The locks acquired by the transaction are released.</li>\n	<li>The work done by the transaction becomes permanent.</li>\n</ul>\n\n<p>A ROLLBACK statement gets issued when the transaction ends, and the following is not true.</p>\n\n<ul>\n	<li>The work done in a transition is undone as if it was never issued.</li>\n	<li>All locks acquired by transaction are released.</li>\n	<li>It undoes all the work done by the user in a transaction.</li>\n</ul>\n\n<p>With SAVEPOINT, entire part of transaction can be undone.</p>\n\",\"isCorrect\":false,\"key\":\"B\"}],\"score\":\"10\",\"createdBy\":2,\"createdOn\":\"2/24/2021\"}', 'PLSQL', 'Programming', NULL, NULL, '2021-02-24 12:05:30', '2'),
(100, '{\"question\":\"Triggers & its types\",\"description\":\"<p>Which of the following statements about Triggers is true?</p>\n\n<p><strong>A</strong></p>\n\n<p>A trigger is a not a piece of code attached to a table that is executed after specified DML statements executed on that table. There are 12 types of triggers in PL/SQL that consist of combinations of the BEFORE, AFTER, ROW, STATEMENT, TABLE, INSERT, UPDATE, DELETE and ALL key words: For eg: BEFORE ALL ROW INSERT AFTER ALL ROW INSERT BEFORE INSERT AFTER INSERT</p>\n\n<p><strong>B</strong></p>\n\n<p>A trigger is a piece of code attached to a table that is executed after specified DML statements executed on that table. There are 12 types of triggers in PL/SQL that consist of combinations of the BEFORE, AFTER, ROW, STATEMENT, TABLE, INSERT, UPDATE, DELETE and ALL key words: For eg: BEFORE ALL ROW INSERT AFTER ALL ROW INSERT BEFORE INSERT AFTER INSERT</p>\n\",\"category\":\"Programming\",\"skill\":\"PLSQL\",\"minimumExperience\":1,\"maximumExperience\":10,\"choices\":[{\"content\":\"<p>A</p>\n\",\"isCorrect\":false,\"key\":\"A\"},{\"content\":\"<p>B</p>\n\",\"isCorrect\":true,\"key\":\"B\"}],\"createdBy\":2,\"createdOn\":\"2/24/2021\"}', 'PLSQL', 'Programming', NULL, NULL, '2021-02-24 11:49:01', '2'),
(101, '{\"question\":\"Types of Joins\",\"description\":\"<p>Which of the following statements are true about JOINS?</p>\n\n<p><strong>A</strong></p>\n\n<p><strong>Self Join </strong>- Joining the table with itself.</p>\n\n<p><strong>Equi Join</strong> - Joining two tables by equating two common columns.</p>\n\n<p><strong>Non-Equi Join</strong> - Joining two tables by not equating two common columns.</p>\n\n<p><strong>Outer Join</strong> - Joining two tables in such a way that query can also retrieve rows that do not have corresponding join value in the other table.</p>\n\n<p>&nbsp;</p>\n\n<p><strong>B</strong></p>\n\n<p><strong>Self Join </strong>- Joining the table without itself.</p>\n\n<p><strong>Equi Join</strong>&nbsp;- Not Joining two tables by equating two common columns.</p>\n\n<p><strong>Non-Equi Join</strong> - Joining two tables by equating two common columns.</p>\n\n<p><strong>Outer Join</strong> - Joining two tables in such a way that query can not retrieve rows that do not have corresponding join value in the other table.</p>\n\",\"category\":\"Programming\",\"skill\":\"PLSQL\",\"minimumExperience\":1,\"maximumExperience\":10,\"choices\":[{\"content\":\"<p>A</p>\n\",\"isCorrect\":true,\"key\":\"A\"},{\"content\":\"<p>B</p>\n\",\"isCorrect\":false,\"key\":\"B\"}],\"score\":\"10\",\"createdBy\":2,\"createdOn\":\"2/24/2021\"}', 'PLSQL', 'Programming', NULL, NULL, '2021-02-24 11:58:37', '2'),
(109, '{\"question\":\"Indian States & Cities\",\"description\":\"<p>Patnitop and Pahalgam cities belong to Himachal Pradesh.</p>\n\",\"category\":\"General Knowledge\",\"skill\":\"Academic\",\"minimumExperience\":0,\"maximumExperience\":10,\"choices\":[{\"content\":\"<p>True</p>\n\",\"isCorrect\":false,\"key\":\"A\"},{\"content\":\"<p>False</p>\n\",\"isCorrect\":true,\"key\":\"B\"}],\"score\":\"5\",\"createdBy\":2,\"createdOn\":\"2/26/2021\"}', NULL, 'General Knowledge', NULL, NULL, '2021-02-26 16:02:05', '37'),
(110, '{\"question\":\"Indian States & Cities\",\"description\":\"<p>Badrinath is a famous city that belongs to Bihar.</p>\n\",\"category\":\"General Knowledge\",\"skill\":\"Academic\",\"minimumExperience\":0,\"maximumExperience\":10,\"choices\":[{\"content\":\"<p>True</p>\n\",\"isCorrect\":false,\"key\":\"A\"},{\"content\":\"<p>False</p>\n\",\"isCorrect\":true,\"key\":\"B\"}],\"score\":\"5\",\"createdBy\":2,\"createdOn\":\"2/26/2021\"}', NULL, 'General Knowledge', NULL, NULL, '2021-02-26 16:05:07', '37'),
(77, '{\"choices\":[{\"content\":\"A REF CURSOR is not a data type. A variable created based on such a data type is generally not called a cursor variable. A cursor variable cannot be associated with different queries at run-time. The primary advantage of using cursor variables is their capability to pass result sets between sub programs (like stored procedures, functions, packages etc.)\",\"isCorrect\":false,\"key\":\"A\"},{\"content\":\"A REF CURSOR is basically a data type. A variable created based on such a data type is generally called a cursor variable. A cursor variable can be associated with different queries at run-time. The primary advantage of using cursor variables is their capability to pass result sets between sub programs (like stored procedures, functions, packages etc.)\",\"isCorrect\":true,\"key\":\"B\"}],\"category\":\"Programming\",\"skill\":\"PLSQL\",\"question\":\"Cursor\",\"description\":\"What is Ref Cursor?\",\"minimumExperience\":\"1\",\"maximumExperience\":\"10\",\"score\":\"10\",\"correctAnswer\":\"B\",\"addedBy\":\"encasherr@gmail.com\"}', 'PLSQL', 'Programming', NULL, NULL, '2020-12-13 21:10:59', '2'),
(111, '{\"question\":\"Indian States & Cities\",\"description\":\"<p>Gulmarg city belongs to Jammu &amp; Kashmir.</p>\n\",\"category\":\"General Knowledge\",\"skill\":\"Academic\",\"minimumExperience\":0,\"maximumExperience\":10,\"choices\":[{\"content\":\"<p>True</p>\n\",\"isCorrect\":true,\"key\":\"A\"},{\"content\":\"<p>False</p>\n\",\"isCorrect\":false,\"key\":\"B\"}],\"score\":\"5\",\"createdBy\":2,\"createdOn\":\"2/26/2021\"}', NULL, 'General Knowledge', NULL, NULL, '2021-02-26 16:06:36', '37'),
(112, '{\"question\":\"Indian States & Cities\",\"description\":\"<p>Hampi city belongs to Karnataka.</p>\r\n\",\"category\":\"General Knowledge\",\"skill\":\"Academic\",\"minimumExperience\":0,\"maximumExperience\":10,\"choices\":[{\"content\":\"<p>True</p>\r\n\",\"isCorrect\":true,\"key\":\"A\"},{\"content\":\"<p>False</p>\r\n\",\"isCorrect\":false,\"key\":\"B\"}],\"score\":\"5\",\"createdBy\":2,\"createdOn\":\"2/26/2021\"}', NULL, 'General Knowledge', NULL, NULL, '2021-02-26 16:14:17', '37'),
(79, '{\"choices\":[{\"content\":\"Joins are not used to retrieve data from more than one table.\nThere are 15 different types of joins.\",\"isCorrect\":false,\"key\":\"A\"},{\"content\":\"Joins are used to retrieve data from more than one table.\nThere are 5 different types of joins.\",\"isCorrect\":true,\"key\":\"B\"}],\"category\":\"Programming\",\"skill\":\"PLSQL\",\"question\":\"JOINS\",\"description\":\"What are Joins and how many types of Joins are there?\",\"minimumExperience\":\"1\",\"maximumExperience\":\"10\",\"score\":\"10\",\"correctAnswer\":\"B\",\"addedBy\":\"encasherr@gmail.com\"}', 'PLSQL', 'Programming', NULL, NULL, '2020-12-13 21:10:59', '2'),
(80, '{\"choices\":[{\"content\":\"CHAR does not adds blank spaces to a maximum length, whereas VARCHAR2 also adds blank spaces\",\"isCorrect\":false,\"key\":\"A\"},{\"content\":\"CHAR pads blank spaces to a maximum length, whereas VARCHAR2 does not pad blank spaces\",\"isCorrect\":true,\"key\":\"B\"}],\"category\":\"Programming\",\"skill\":\"PLSQL\",\"question\":\"Data Types\",\"description\":\"What is the main difference between CHAR and VARCHAR2?\",\"minimumExperience\":\"1\",\"maximumExperience\":\"10\",\"score\":\"10\",\"correctAnswer\":\"B\",\"addedBy\":\"encasherr@gmail.com\"}', 'PLSQL', 'Programming', NULL, NULL, '2020-12-13 21:10:59', '2'),
(81, '{\"choices\":[{\"content\":\"SELECT a.emp_name,a.sal FROM emp a WHERE &n - 1= (DEPOSIT COUNT(DISTINCT sal) FROM emp b WHERE b.sal > a.sal )\",\"isCorrect\":false,\"key\":\"A\"},{\"content\":\"SELECT a.emp_name,a.sal FROM emp a WHERE &n - 1= (SELECT COUNT(DISTINCT sal) FROM emp b WHERE b.sal > a.sal )\",\"isCorrect\":true,\"key\":\"B\"}],\"category\":\"Programming\",\"skill\":\"PLSQL\",\"question\":\"Queries\",\"description\":\"Select nth highest value from a list of values\",\"minimumExperience\":\"1\",\"maximumExperience\":\"10\",\"score\":\"10\",\"correctAnswer\":\"B\",\"addedBy\":\"encasherr@gmail.com\"}', 'PLSQL', 'Programming', NULL, NULL, '2020-12-13 21:10:59', '2'),
(82, '{\"choices\":[{\"content\":\"Yes\",\"isCorrect\":true,\"key\":\"A\"},{\"content\":\"No\",\"isCorrect\":false,\"key\":\"B\"}],\"category\":\"Programming\",\"skill\":\"PLSQL\",\"question\":\"Queries\",\"description\":\"Can you use IF statement inside a SELECT statement?\",\"minimumExperience\":\"1\",\"maximumExperience\":\"10\",\"score\":\"10\",\"correctAnswer\":\"A\",\"addedBy\":\"encasherr@gmail.com\"}', 'PLSQL', 'Programming', NULL, NULL, '2020-12-13 21:10:59', '2'),
(99, '{\"question\":\"Integrity Constraints\",\"description\":\"<p>What is Referential Integrity and Referential integrity constraint ?</p>\n\",\"category\":\"Programming\",\"skill\":\"PLSQL\",\"minimumExperience\":1,\"maximumExperience\":10,\"choices\":[{\"content\":\"<p><strong>Referential integrity</strong> does not define the relationships among different columns and tables in a relational database. It is called referential integrity because the values in one column or set of columns refer to or must not match the values in a related column or set of columns.</p>\n\n<p>A <strong>referential integrity constraint</strong> does not require that for each row of a table, the value in the foreign key matches a value in a parent key.</p>\n\",\"isCorrect\":false,\"key\":\"A\"},{\"content\":\"<p><strong>Referential integrity</strong> defines the relationships among different columns and tables in a relational database. It is called referential integrity because the values in one column or set of columns refer to or must match the values in a related column or set of columns.</p>\n\n<p>A <strong>referential integrity constraint</strong> requires that for each row of a table, the value in the foreign key matches a value in a parent key.</p>\n\",\"isCorrect\":true,\"key\":\"B\"}],\"score\":\"10\",\"createdBy\":2,\"createdOn\":\"2/24/2021\"}', 'PLSQL', 'Programming', NULL, NULL, '2021-02-24 11:40:19', '2'),
(98, '{\"question\":\"SQL statement execution\",\"description\":\"<p>What are steps involved in Execution of SQL statements?</p>\n\",\"category\":\"Programming\",\"skill\":\"PLSQL\",\"minimumExperience\":1,\"maximumExperience\":10,\"choices\":[{\"content\":\"<ul>\n	<li>Create a cursor&nbsp;</li>\n	<li>Parse the statement</li>\n	<li>Describe Results</li>\n	<li>Defining outputs</li>\n	<li>Find any variables</li>\n	<li>Execute the statement</li>\n	<li>Fetch rows of a query result</li>\n</ul>\n\",\"isCorrect\":true,\"key\":\"A\"},{\"content\":\"<ul>\n	<li>Defining outputs</li>\n	<li>Parse the statement</li>\n	<li>Describe Results&nbsp;</li>\n	<li>Create a cursor</li>\n	<li>Find any variables</li>\n	<li>Execute the statement</li>\n	<li>Fetch rows of a query result</li>\n</ul>\n\",\"isCorrect\":false,\"key\":\"B\"}],\"score\":\"10\",\"createdBy\":2,\"createdOn\":\"2/24/2021\"}', 'PLSQL', 'Programming', NULL, NULL, '2021-02-24 11:28:44', '2'),
(85, '{\"choices\":[{\"content\":\"Declaring a CURSOR\nOpen the CURSOR\nFETCH the rows from the CURSOR\nCLOSE the CURSOR\",\"isCorrect\":true,\"key\":\"A\"},{\"content\":\"Declaring a CURSOR\nOpen the CURSOR\nFETCH the rows from the CURSOR\n\",\"isCorrect\":false,\"key\":\"B\"}],\"category\":\"Programming\",\"skill\":\"PLSQL\",\"question\":\"Cursor\",\"description\":\"What are the pl/sql statements used in cursor in sequence?\",\"minimumExperience\":\"1\",\"maximumExperience\":\"10\",\"score\":\"10\",\"correctAnswer\":\"A\",\"addedBy\":\"encasherr@gmail.com\"}', 'PLSQL', 'Programming', NULL, NULL, '2020-12-13 21:10:59', '2'),
(86, '{\"choices\":[{\"content\":\"CHAR is fixed length character type at storage level, and that VARCHAR will be variable length.\",\"isCorrect\":true,\"key\":\"A\"},{\"content\":\"CHAR is not a fixed length character type at storage level, and that VARCHAR will be variable length.\",\"isCorrect\":false,\"key\":\"B\"}],\"category\":\"Programming\",\"skill\":\"PLSQL\",\"question\":\"Data Types\",\"description\":\"What is the difference between CHAR and VARCHAR?\",\"minimumExperience\":\"1\",\"maximumExperience\":\"10\",\"score\":\"10\",\"correctAnswer\":\"A\",\"addedBy\":\"encasherr@gmail.com\"}', 'PLSQL', 'Programming', NULL, NULL, '2020-12-13 21:10:59', '2'),
(97, '{\"question\":\"Cursor & Its Types\",\"description\":\"<p>What is a cursor and its types?</p>\n\",\"category\":\"Programming\",\"skill\":\"PLSQL\",\"minimumExperience\":1,\"maximumExperience\":10,\"choices\":[{\"content\":\"<p>The Oracle Engine uses a work area for its internal processing in order to execute an SQL statement. This work area is public to SQL operation and is called Cursor.</p>\n\n<p>Types of Cursor:</p>\n\n<p><strong>Implicit Cursor:</strong> If the Oracle engine does not open a cursor for its internal processing then it is know as implicit cursor. It is invoked implicitly.&nbsp;</p>\n\n<p><strong>Explicit Cursor: </strong>A cursor which is not opened for processing data through a PL/SQL block is know as Explicit Cursor.</p>\n\",\"isCorrect\":false,\"key\":\"A\"},{\"content\":\"<p>The Oracle Engine uses a work area for its internal processing in order to execute an SQL statement. This work area is private to SQL operation and is called Cursor.</p>\n\n<p>Types of Cursor:</p>\n\n<p><strong>Implicit Cursor:</strong> If the Oracle engine opened a cursor for its internal processing then it is know as implicit cursor. It is invoked implicitly.</p>\n\n<p><strong>Explicit Cursor:</strong> A cursor which is opened for processing data through a PL/SQL block is know as Explicit Cursor.</p>\n\",\"isCorrect\":true,\"key\":\"B\"}],\"score\":\"10\",\"createdBy\":2,\"createdOn\":\"2/24/2021\"}', 'PLSQL', 'Programming', NULL, NULL, '2021-02-24 11:22:24', '2'),
(88, '{\"choices\":[{\"content\":\"NVL does not let the programmer substitute a value for a NULL value.\",\"isCorrect\":false,\"key\":\"A\"},{\"content\":\"NVL lets the programmer substitute a value for a NULL value.\",\"isCorrect\":true,\"key\":\"B\"}],\"category\":\"Programming\",\"skill\":\"PLSQL\",\"question\":\"Queries\",\"description\":\"What is the purpose of NVL?\",\"minimumExperience\":\"1\",\"maximumExperience\":\"10\",\"score\":\"10\",\"correctAnswer\":\"B\",\"addedBy\":\"encasherr@gmail.com\"}', 'PLSQL', 'Programming', NULL, NULL, '2020-12-13 21:10:59', '2'),
(96, '{\"question\":\"General Functions\",\"description\":\"<p>Describe different types of General Function used in SQL</p>\n\",\"category\":\"Programming\",\"skill\":\"PLSQL\",\"minimumExperience\":1,\"maximumExperience\":10,\"choices\":[{\"content\":\"<p>General functions are of following types:</p>\n\n<ul>\n	<li>NVL: Does not convert a null value to an actual value. NVL (exp1, exp2) .If exp1 is null then NVL function return value of exp2.&nbsp;</li>\n	<li>NVL2: If exp1 is null, nvl2 returns exp2, if exp1 is null, nvl2 returns exp3. The argument exp1 can have any data type. NVL2 (exp1, exp2, exp3)&nbsp;</li>\n	<li>NULLIF: Compares two expressions and does not return null if they are equal or the first expression if they are not equal. NULLIF (exp1, exp2)&nbsp;</li>\n	<li>COALESCE: Returns the first non-null expression in the expression list. COALESCE (exp1, exp2,&nbsp;expn). The advantage of the COALESCE function over NVL function is that the COALESCE function can take multiple alternative values.</li>\n	<li>Conditional Expressions: Provide the use of IF-THEN-ELSE logic within a SQL statement. Example: CASE Expression and DECODE Function</li>\n</ul>\n\",\"isCorrect\":false,\"key\":\"A\"},{\"content\":\"<p>General functions are of following types:</p>\n\n<ul>\n	<li>NVL: Converts a null value to an actual value. NVL (exp1, exp2) .If exp1 is null then NVL function return value of exp2.</li>\n	<li>NVL2: If exp1 is not null, nvl2 returns exp2, if exp1 is null, nvl2 returns exp3. The argument exp1 can have any data type. NVL2 (exp1, exp2, exp3)</li>\n	<li>NULLIF: Compares two expressions and returns null if they are equal or the first expression if they are not equal. NULLIF (exp1, exp2)</li>\n	<li>COALESCE: Returns the first non-null expression in the expression list. COALESCE (exp1, exp2, expn). The advantage of the COALESCE function over NVL function is that the COALESCE function can take multiple alternative values.</li>\n	<li>Conditional Expressions: Provide the use of IF-THEN-ELSE logic within a SQL statement. Example: CASE Expression and DECODE Function.</li>\n</ul>\n\",\"isCorrect\":true,\"key\":\"B\"}],\"score\":\"10\",\"createdBy\":2,\"createdOn\":\"2/24/2021\"}', 'PLSQL', 'Programming', NULL, NULL, '2021-02-24 11:11:14', '2'),
(91, '{\"question\":\"Implicit Cursor\",\"description\":\"To write unnamed SQL statements, we use Implicit Cursors.\",\"category\":\"Programming\",\"skill\":\"PLSQL\",\"minimumExperience\":1,\"maximumExperience\":10,\"choices\":[{\"content\":\"True\",\"isCorrect\":true,\"key\":\"A\"},{\"content\":\"False\",\"isCorrect\":false,\"key\":\"B\"}],\"score\":\"10\",\"createdBy\":2,\"createdOn\":\"2/23/2021\"}', 'PLSQL', 'Programming', NULL, NULL, '2021-02-23 21:04:53', '2'),
(92, '{\"question\":\"Cursor attributes of PL/SQL\",\"description\":\"<p>Which group of statements&nbsp;of the following is true ?</p>\n\n<p><strong>A</strong></p>\n\n<ul>\n	<li><strong>%ISOPEN</strong> : Checks if the cursor has fetched any row. It is true if rows are fetched</li>\n	<li><strong>%ROWCOUNT</strong> : The number of rows that are updated, deleted or fetched</li>\n	<li><strong>%FOUND</strong> : Checks if the cursor has fetched any row. It is True if rows are not fetched</li>\n	<li><strong>%NOTFOUND</strong> : Checks if the cursor has fetched any row. It is true if rows are fetched</li>\n</ul>\n\n<p><strong>B</strong></p>\n\n<ul>\n	<li><strong>%ISOPEN</strong> : Checks if the cursor is open or not</li>\n	<li><strong>%ROWCOUNT</strong> : The number of rows that are updated, deleted or fetched</li>\n	<li><strong>%FOUND</strong> : Checks if the cursor has fetched any row. It is true if rows are fetched</li>\n	<li><strong>%NOTFOUND</strong> : Checks if the cursor has fetched any row. It is True if rows are not fetched</li>\n</ul>\n\",\"category\":\"Programming\",\"skill\":\"PLSQL\",\"minimumExperience\":1,\"maximumExperience\":10,\"choices\":[{\"content\":\"A\",\"isCorrect\":false,\"key\":\"A\"},{\"content\":\"B\",\"isCorrect\":true,\"key\":\"B\"}],\"score\":\"10\",\"createdBy\":2,\"createdOn\":\"2/24/2021\"}', 'PLSQL', 'Programming', NULL, NULL, '2021-02-24 09:39:51', '2'),
(93, '{\"question\":\"Types of Joins\",\"description\":\"<p>Explain all Joins used in Oracle 9i and later release?</p>\n\",\"category\":\"Programming\",\"skill\":\"PLSQL\",\"minimumExperience\":0,\"maximumExperience\":10,\"choices\":[{\"content\":\"<ul>\n	<li><strong>Cross Join: </strong>Cross Join clause does not produce the cross-product of two tables. This is same as a Cartesian product between the two tables.&nbsp;</li>\n	<li><strong>UnNatural Joins: </strong>Is used to join two tables automatically based on the columns which have matching data types and names, using the keyword NATURAL JOIN. It is equal to the Equi-Join. If the columns have the same names but different data types, than the Natural Join syntax causes an error. Join with the SING clause: If several columns have the same names but the data types do not match, than the NATURAL JOIN clause can be modified with the USING clause to specify the columns that should be used for an equi Join. Use the USING clause to match only one column when more than one column matches. Do not use a table name or alias in the referenced columns. The NATURAL JOIN clause and USING clause are mutually exclusive. For ex: Select a.city, b.dept_name from loc a Join dept b USING (loc_id) where loc_id=10; Joins with the OF clause: Does not use the ON clause to specify a join condition. The ON clause makes code easy to understand. ON clause is equals to Self Joins. The ON clause can also be used to join columns that have different names.</li>\n	<li><strong>Left/ Right/ Full Outer Joins</strong>: Left Outer Join does not display all rows from the table that is Left to the LEFT OUTER JOIN clause, right outer join displays all rows from the table that is right to the RIGHT OUTER JOIN clause, and full outer join displays all rows from both the tables either left or right to the FULL OUTER JOIN clause.</li>\n</ul>\n\",\"isCorrect\":false,\"key\":\"A\"},{\"content\":\"<ul>\n	<li><strong>Cross Join:</strong> Cross Join clause produces the cross-product of two tables. This is same as a Cartesian product between the two tables.</li>\n	<li><strong>Natural Joins:</strong> Is used to join two tables automatically based on the columns which have matching data types and names, using the keyword NATURAL JOIN. It is equal to the Equi-Join. If the columns have the same names but different data types, than the Natural Join syntax causes an error. Join with the USING clause: If several columns have the same names but the data types do not match, than the NATURAL JOIN clause can be modified with the USING clause to specify the columns that should be used for an equi Join. Use the USING clause to match only one column when more than one column matches. Do not use a table name or alias in the referenced columns. The NATURAL JOIN clause and USING clause are mutually exclusive. For ex: Select a.city, b.dept_name from loc a Join dept b USING (loc_id) where loc_id=10; Joins with the ON clause: Use the ON clause to specify a join condition. The ON clause makes code easy to understand. ON clause is equals to Self Joins. The ON clause can also be used to join columns that have different names</li>\n	<li><strong>Left/ Right/ Full Outer Joins:</strong> Left Outer Join displays all rows from the table that is Left to the LEFT OUTER JOIN clause, right outer join displays all rows from the table that is right to the RIGHT OUTER JOIN clause, and full outer join displays all rows from both the tables either left or right to the FULL OUTER JOIN clause</li>\n</ul>\n\",\"isCorrect\":true,\"key\":\"B\"}],\"score\":\"10\",\"createdBy\":2,\"createdOn\":\"2/24/2021\"}', 'PLSQL', 'Programming', NULL, NULL, '2021-02-24 10:25:07', '2'),
(94, '{\"question\":\"Clause\",\"description\":\"<p>Which of the following is true for Group By and Having clauses?</p>\n\",\"category\":\"Programming\",\"skill\":\"PLSQL\",\"minimumExperience\":1,\"maximumExperience\":10,\"choices\":[{\"content\":\"<ul>\n	<li><strong>Group by clause</strong> tells oracle to ungroup rows based on distinct values that exists for specified columns. The group by clause creates a data set , containing several sets of records grouped together based on condition.</li>\n	<li><strong>Having clause</strong> cannot be used with GROUP BY clause. Having imposes a condition on the group by clause which further filters the group created by the GROUP BY clause.</li>\n</ul>\n\",\"isCorrect\":false,\"key\":\"A\"},{\"content\":\"<ul>\n	<li><strong>Group by clause</strong> tells oracle to group rows based on distinct values that exists for specified columns. The group by clause creates a data set , containing several sets of records grouped together based on condition.</li>\n	<li><strong>Having clause</strong> can be used with GROUP BY clause. Having imposes a condition on the group by clause which further filters the group created by the GROUP BY clause.</li>\n</ul>\n\",\"isCorrect\":true,\"key\":\"B\"}],\"score\":\"10\",\"createdBy\":2,\"createdOn\":\"2/24/2021\"}', 'PLSQL', 'Programming', NULL, NULL, '2021-02-24 10:29:45', '2'),
(95, '{\"question\":\"SQL Statements\",\"description\":\"<p>What is SQL and also describe types of SQL statements?</p>\n\",\"category\":\"Programming\",\"skill\":\"PLSQL\",\"minimumExperience\":1,\"maximumExperience\":10,\"choices\":[{\"content\":\"<p>SQL is a language not used to communicate with the server to access, manipulate and control data.&nbsp;</p>\n\n<p>There are 5 different types of SQL statements.&nbsp;</p>\n\n<ul>\n	<li>Data Retrieval: SELECT</li>\n	<li>Data Manipulation Language (DML): INSERT, UPDATE, DELETE, MERGE</li>\n	<li>Data Definition Language (DDL): CREATE, ALTERR, DROPP, RENAME, TRUNCATE.</li>\n	<li>Transaction Control Statements: COMMITT, ROLLBACK, SAVEPOINT</li>\n	<li>Data Control Language (DCL): GRAND, REVOKE</li>\n</ul>\n\",\"isCorrect\":false,\"key\":\"A\"},{\"content\":\"<p>SQL stands for Structured Query Language. SQL is a language used to communicate with the server to access, manipulate and control data.</p>\n\n<p>There are 5 different types of SQL statements.</p>\n\n<ul>\n	<li>Data Retrieval: SELECT</li>\n	<li>Data Manipulation Language (DML): INSERT, UPDATE, DELETE, MERGE</li>\n	<li>Data Definition Language (DDL): CREATE, ALTER, DROP, RENAME, TRUNCATE.</li>\n	<li>Transaction Control Statements: COMMIT, ROLLBACK, SAVEPOINT</li>\n	<li>Data Control Language (DCL): GRANT, REVOKE</li>\n</ul>\n\",\"isCorrect\":true,\"key\":\"B\"}],\"score\":\"10\",\"createdBy\":2,\"createdOn\":\"2/24/2021\"}', 'PLSQL', 'Programming', NULL, NULL, '2021-02-24 10:34:50', '2'),
(113, '{\"question\":\"Indian Cities\",\"description\":\"<p>Which of the following cities belong to Gujarat?</p>\n\",\"category\":\"General Knowledge\",\"skill\":\"Academic\",\"minimumExperience\":0,\"maximumExperience\":10,\"choices\":[{\"content\":\"<p>Ayodhya</p>\n\",\"isCorrect\":false,\"key\":\"A\"},{\"content\":\"<p>Vrindavan</p>\n\",\"isCorrect\":false,\"key\":\"B\"},{\"content\":\"<p>Dwarka</p>\n\",\"isCorrect\":true,\"key\":\"C\"},{\"content\":\"<p>Guruvayur</p>\n\",\"isCorrect\":false,\"key\":\"D\"}],\"score\":\"5\",\"createdBy\":37,\"createdOn\":\"3/8/2021\"}', NULL, 'General Knowledge', NULL, NULL, '2021-03-08 16:25:56', '37'),
(114, '{\"question\":\"Indian Cities\",\"description\":\"<p>Which of the following places belong to Uttar Pradesh?</p>\n\",\"category\":\"General Knowledge\",\"skill\":\"Academic\",\"minimumExperience\":0,\"maximumExperience\":10,\"choices\":[{\"content\":\"<p>Ayodhya</p>\n\",\"isCorrect\":true,\"key\":\"A\"},{\"content\":\"<p>Gangotri</p>\n\",\"isCorrect\":false,\"key\":\"B\"},{\"content\":\"<p>Varanasi</p>\n\",\"isCorrect\":true,\"key\":\"C\"},{\"content\":\"<p>Kedarnath</p>\n\",\"isCorrect\":false,\"key\":\"D\"}],\"score\":\"5\",\"createdBy\":37,\"createdOn\":\"3/8/2021\"}', NULL, 'General Knowledge', NULL, NULL, '2021-03-08 16:44:48', '37'),
(115, '{\"question\":\"Indian Cities\",\"description\":\"<p>Pandharpur belongs to which state of India?</p>\n\",\"category\":\"General Knowledge\",\"skill\":\"Academic\",\"minimumExperience\":0,\"maximumExperience\":10,\"choices\":[{\"content\":\"<p>Gujarat</p>\n\",\"isCorrect\":false,\"key\":\"A\"},{\"content\":\"<p>Himachal Pradesh</p>\n\",\"isCorrect\":false,\"key\":\"B\"},{\"content\":\"<p>Maharashtra</p>\n\",\"isCorrect\":true,\"key\":\"C\"},{\"content\":\"<p>Uttar Pradesh</p>\n\",\"isCorrect\":false,\"key\":\"D\"}],\"score\":\"5\",\"createdBy\":37,\"createdOn\":\"3/8/2021\"}', NULL, 'General Knowledge', NULL, NULL, '2021-03-08 16:51:28', '37'),
(116, '{\"question\":\"Indian Cities\",\"description\":\"<p>Which of the below are capital cities of their respective states of India?</p>\n\",\"category\":\"General Knowledge\",\"skill\":\"Academic\",\"minimumExperience\":0,\"maximumExperience\":10,\"choices\":[{\"content\":\"<p>Ajmer</p>\n\",\"isCorrect\":false,\"key\":\"A\"},{\"content\":\"<p>Panaji</p>\n\",\"isCorrect\":true,\"key\":\"B\"},{\"content\":\"<p>Indore</p>\n\",\"isCorrect\":false,\"key\":\"C\"},{\"content\":\"<p>Chennai</p>\n\",\"isCorrect\":true,\"key\":\"D\"}],\"score\":\"5\",\"createdBy\":37,\"createdOn\":\"3/8/2021\"}', NULL, 'General Knowledge', NULL, NULL, '2021-03-08 17:01:07', '37'),
(117, '{\"question\":\"Indian Cities\",\"description\":\"<p>Which of the following are Union Territories of India?</p>\r\n\",\"category\":\"General Knowledge\",\"skill\":\"Academic\",\"minimumExperience\":0,\"maximumExperience\":10,\"choices\":[{\"content\":\"<p>Puducherry</p>\r\n\",\"isCorrect\":true,\"key\":\"A\"},{\"content\":\"<p>Goa</p>\r\n\",\"isCorrect\":false,\"key\":\"B\"},{\"content\":\"<p>Ladakh</p>\r\n\",\"isCorrect\":true,\"key\":\"C\"},{\"content\":\"<p>Assam</p>\r\n\",\"isCorrect\":false,\"key\":\"D\"}],\"score\":\"5\",\"createdBy\":37,\"createdOn\":\"3/8/2021\"}', NULL, 'General Knowledge', NULL, NULL, '2021-03-08 17:05:37', '37'),
